Name;FECHA;INVESTIGACION;PREDIO;ESTADO;BARRIO;ESTRATO;AREA_PRIVADA;AREA_LOTE;VALORCOMERCIAL;VALORM2;LONGITUD;LATITUD;ANIO;MES;DIA
171123;05-02-2021;VENTA           ;APARTAMENTO         ;NUEVO     ;LA COLINA;3;126;76;300000000;2380952;-75,59396631;6,19830091;2021;2;5
171239;10-02-2021;VENTA           ;APARTAMENTO         ;NUEVO     ;ZONA EXPANSION PAJARITO;3;47;14;150000000;3191489;-75,60971395;6,28561574;2021;2;10
171240;10-02-2021;VENTA           ;APARTAMENTO         ;NUEVO     ;ZONA EXPANSION PAJARITO;3;47;14;160000000;3404255;-75,60971395;6,28561574;2021;2;10
171241;10-02-2021;VENTA           ;APARTAMENTO         ;NUEVO     ;ZONA EXPANSION PAJARITO;3;47;14;150000000;3191489;-75,60971395;6,28561574;2021;2;10
171247;11-02-2021;VENTA           ;APARTAMENTO         ;NUEVO     ;ZONA EXPANSION PAJARITO;3;50;18;175000000;3500000;-75,60927162;6,28522799;2021;2;11
171248;11-02-2021;VENTA           ;APARTAMENTO         ;NUEVO     ;ZONA EXPANSION PAJARITO;3;50;18;170000000;3400000;-75,60927162;6,28522799;2021;2;11
171270;12-02-2021;VENTA           ;APARTAMENTO         ;NUEVO     ;ZONA EXPANSION PAJARITO;3;52;18;150000000;2884615;-75,60927162;6,28522799;2021;2;12
171271;12-02-2021;VENTA           ;APARTAMENTO         ;NUEVO     ;ZONA EXPANSION PAJARITO;3;52;17;155000000;2980769;-75,60927162;6,28522799;2021;2;12
171364;17-02-2021;VENTA           ;APARTAMENTO         ;NUEVO     ;SAN GERMAN;4;71;16;340000000;4788732;-75,59139901;6,27051874;2021;2;17
171365;17-02-2021;VENTA           ;APARTAMENTO         ;NUEVO     ;SAN GERMAN;4;64;15;310000000;4843750;-75,59086143;6,26926496;2021;2;17
171366;17-02-2021;VENTA           ;APARTAMENTO         ;NUEVO     ;SAN GERMAN;4;67;15;320000000;4776119;-75,59139901;6,27051874;2021;2;17
171372;17-02-2021;VENTA           ;APARTAMENTO         ;NUEVO     ;SAN GERMAN;4;64;15;292000000;4562500;-75,59086143;6,26926496;2021;2;17
171374;17-02-2021;VENTA           ;APARTAMENTO         ;NUEVO     ;SAN GERMAN;4;86;15;416000000;4837209;-75,59007;6,27062346;2021;2;17
171378;17-02-2021;VENTA           ;APARTAMENTO         ;NUEVO     ;SAN GERMAN;4;75;13;365000000;4866667;-75,59007;6,27062346;2021;2;17
171384;17-02-2021;VENTA           ;APARTAMENTO         ;NUEVO     ;SAN GERMAN;4;70;20;320000000;4571429;-75,58930377;6,26874735;2021;2;17
171390;17-02-2021;VENTA           ;APARTAMENTO         ;NUEVO     ;SAN GERMAN;4;48;13;250000000;5208333;-75,59178686;6,27006898;2021;2;17
171393;17-02-2021;VENTA           ;APARTAMENTO         ;NUEVO     ;SAN GERMAN;4;63;19;330000000;5238095;-75,59178686;6,27006898;2021;2;17
171396;17-02-2021;VENTA           ;APARTAMENTO         ;NUEVO     ;SAN GERMAN;4;64;17;270000000;4218750;-75,59178686;6,27006898;2021;2;17
171399;17-02-2021;VENTA           ;APARTAMENTO         ;NUEVO     ;SAN GERMAN;4;89;15;430000000;4831461;-75,59043285;6,26973696;2021;2;17
171464;18-02-2021;VENTA           ;APARTAMENTO         ;NUEVO     ;PALENQUE;4;38;9;120000000;3157895;-75,59637123;6,27927074;2021;2;18
171465;18-02-2021;VENTA           ;APARTAMENTO         ;NUEVO     ;PALENQUE;4;37;9;115000000;3108108;-75,59637123;6,27927074;2021;2;18
171846;13-04-2021;VENTA           ;APARTAMENTO         ;NUEVO     ;EL ESTADIO;5;67;25;380000000;5671642;-75,5920807;6,25877456;2021;4;13
171878;13-04-2021;VENTA           ;APARTAMENTO         ;NUEVO     ;BOMBONA # 1;4;30;4;130000000;4333333;-75,56024477;6,24323332;2021;4;13
171943;19-04-2021;VENTA           ;APARTAMENTO         ;NUEVO     ;LAS BRISAS;3;111;46;200000000;1801802;-75,56121987;6,31051482;2021;4;19
171968;20-04-2021;VENTA           ;APARTAMENTO         ;NUEVO     ;LA MILAGROSA;3;52;682;219500000;4221154;-75,55372832;6,23453424;2021;4;20
171977;20-04-2021;VENTA           ;APARTAMENTO         ;NUEVO     ;KENNEDY;3;141;42;190000000;1347518;-75,5843185;6,28960918;2021;4;20
172021;26-04-2021;VENTA           ;APARTAMENTO         ;NUEVO     ;TEJELO;3;78;41;160000000;2051282;-75,57067773;6,30772058;2021;4;26
172029;28-04-2021;VENTA           ;APARTAMENTO         ;NUEVO     ;SANTANDER;2;71;23;135000000;1901408;-75,57614107;6,30501424;2021;4;28
172058;05-05-2021;VENTA           ;APARTAMENTO         ;NUEVO     ;LA PILARICA;5;76;28;340000000;4473684;-75,58505412;6,27554994;2021;5;5
172062;05-05-2021;VENTA           ;APARTAMENTO         ;NUEVO     ;LA PILARICA;5;71;26;290000000;4084507;-75,58371059;6,27560023;2021;5;5
172073;06-05-2021;VENTA           ;APARTAMENTO         ;NUEVO     ;BOYACA;3;130;32;340000000;2615385;-75,56489395;6,30581832;2021;5;6
172075;10-05-2021;VENTA           ;APARTAMENTO         ;NUEVO     ;TEJELO;3;54;34;135000000;2500000;-75,56619762;6,30685004;2021;5;10
172123;18-05-2021;VENTA           ;APARTAMENTO         ;NUEVO     ;LA MOTA;5;75;46;230000000;3066667;-75,59870848;6,20553915;2021;5;18
172126;18-05-2021;VENTA           ;APARTAMENTO         ;NUEVO     ;LA HONDONADA;4;63;13;420000000;6666667;-75,60220586;6,20179671;2021;5;18
172184;20-05-2021;VENTA           ;APARTAMENTO         ;NUEVO     ;ZONA DE EXPANSION BELEN RINCON;5;96;41;470000000;4895833;-75,60699788;6,21581188;2021;5;20
172189;21-05-2021;VENTA           ;APARTAMENTO         ;NUEVO     ;LA PILARICA;5;76;28;340000000;4473684;-75,58505412;6,27554994;2021;5;21
172192;21-05-2021;VENTA           ;APARTAMENTO         ;NUEVO     ;LA PILARICA;3;100;34;470000000;4700000;-75,58569951;6,27413785;2021;5;21
172193;21-05-2021;VENTA           ;APARTAMENTO         ;NUEVO     ;LA PILARICA;3;72;29;320000000;4444444;-75,58569951;6,27413785;2021;5;21
172197;21-05-2021;VENTA           ;APARTAMENTO         ;NUEVO     ;LA PILARICA;5;83;801;395000000;4759036;-75,58562901;6,27393236;2021;5;21
172198;21-05-2021;VENTA           ;APARTAMENTO         ;NUEVO     ;LA PILARICA;5;82;29;345000000;4207317;-75,58393705;6,27374277;2021;5;21
172199;21-05-2021;VENTA           ;APARTAMENTO         ;NUEVO     ;LA PILARICA;5;82;29;345000000;4207317;-75,58393705;6,27374277;2021;5;21
172200;21-05-2021;VENTA           ;APARTAMENTO         ;NUEVO     ;LA PILARICA;5;77;28;339000000;4402597;-75,58393705;6,27374277;2021;5;21
172207;22-05-2021;VENTA           ;APARTAMENTO         ;NUEVO     ;SAN GERMAN;4;67;15;350000000;5223881;-75,59139901;6,27051874;2021;5;22
172928;24-05-2021;VENTA           ;APARTAMENTO         ;NUEVO     ;ZONA DE EXPANSION BELEN RINCON;5;120;41;540000000;4500000;-75,60699788;6,21581188;2021;5;24
172939;24-05-2021;VENTA           ;APARTAMENTO         ;NUEVO     ;LA PILARICA;5;81;374;290000000;3580247;-75,58411272;6,27419172;2021;5;24
172952;24-05-2021;VENTA           ;APARTAMENTO         ;NUEVO     ;LOMA DE LOS BERNAL;5;101;36;440000000;4356436;-75,60301181;6,21931035;2021;5;24
172957;24-05-2021;VENTA           ;APARTAMENTO         ;NUEVO     ;LA PILARICA;5;69;1261;344000000;4985507;-75,58532658;6,27416043;2021;5;24
172959;25-05-2021;VENTA           ;APARTAMENTO         ;NUEVO     ;LA PILARICA;5;72;1261;351000000;4875000;-75,58532658;6,27416043;2021;5;25
172966;25-05-2021;VENTA           ;APARTAMENTO         ;NUEVO     ;SAN GERMAN;4;72;16;390000000;5416667;-75,59139901;6,27051874;2021;5;25
172967;25-05-2021;VENTA           ;APARTAMENTO         ;NUEVO     ;ROSALES;5;90;27;477000000;5300000;-75,59286064;6,23814483;2021;5;25
172969;25-05-2021;VENTA           ;APARTAMENTO         ;NUEVO     ;SAN GERMAN;4;78;13;370000000;4743590;-75,59043285;6,26973696;2021;5;25
172970;25-05-2021;VENTA           ;APARTAMENTO         ;NUEVO     ;SAN GERMAN;4;89;15;440000000;4943820;-75,59043285;6,26973696;2021;5;25
172981;25-05-2021;VENTA           ;APARTAMENTO         ;NUEVO     ;SAN GERMAN;4;56;16;280000000;5000000;-75,58930377;6,26874735;2021;5;25
172982;26-05-2021;VENTA           ;APARTAMENTO         ;NUEVO     ;SAN GERMAN;4;70;20;350000000;5000000;-75,58930377;6,26874735;2021;5;26
172984;26-05-2021;VENTA           ;APARTAMENTO         ;NUEVO     ;SAN GERMAN;4;70;20;340000000;4857143;-75,58930377;6,26874735;2021;5;26
172989;26-05-2021;VENTA           ;APARTAMENTO         ;NUEVO     ;SAN GERMAN;4;48;11;270000000;5625000;-75,59086143;6,26926496;2021;5;26
172992;26-05-2021;VENTA           ;APARTAMENTO         ;NUEVO     ;SAN GERMAN;4;89;14;450000000;5056180;-75,59043285;6,26973696;2021;5;26
172994;26-05-2021;VENTA           ;APARTAMENTO         ;NUEVO     ;SAN GERMAN;4;52;13;270000000;5192308;-75,59178686;6,27006898;2021;5;26
172999;26-05-2021;VENTA           ;APARTAMENTO         ;NUEVO     ;SAN GERMAN;4;71;16;345000000;4859155;-75,59139901;6,27051874;2021;5;26
173000;26-05-2021;VENTA           ;APARTAMENTO         ;NUEVO     ;SAN GERMAN;4;67;15;340000000;5074627;-75,59139901;6,27051874;2021;5;26
173001;26-05-2021;VENTA           ;APARTAMENTO         ;NUEVO     ;SAN GERMAN;4;52;13;270000000;5192308;-75,59178686;6,27006898;2021;5;26
173003;26-05-2021;VENTA           ;APARTAMENTO         ;NUEVO     ;SAN GERMAN;4;64;17;345000000;5390625;-75,59178686;6,27006898;2021;5;26
173089;02-06-2021;VENTA           ;APARTAMENTO         ;NUEVO     ;CALASANZ;5;110;26;450000000;4090909;-75,59800195;6,26244166;2021;6;2
173092;02-06-2021;VENTA           ;APARTAMENTO         ;NUEVO     ;CALASANZ;6;87;22;480000000;5517241;-75,59958838;6,26076218;2021;6;2
173105;02-06-2021;VENTA           ;APARTAMENTO         ;NUEVO     ;SIMON BOLIVAR;5;112;248;548000000;4892857;-75,60591199;6,24673619;2021;6;2
173106;02-06-2021;VENTA           ;APARTAMENTO         ;NUEVO     ;SIMON BOLIVAR;5;155;248;576000000;3716129;-75,60591199;6,24673619;2021;6;2
173107;02-06-2021;VENTA           ;APARTAMENTO         ;NUEVO     ;SIMON BOLIVAR;5;106;248;523000000;4933962;-75,60591199;6,24673619;2021;6;2
173108;02-06-2021;VENTA           ;APARTAMENTO         ;NUEVO     ;SIMON BOLIVAR;5;106;248;520000000;4905660;-75,60591199;6,24673619;2021;6;2
173109;02-06-2021;VENTA           ;APARTAMENTO         ;NUEVO     ;SIMON BOLIVAR;5;112;248;551000000;4919643;-75,60591199;6,24673619;2021;6;2
173121;02-06-2021;VENTA           ;APARTAMENTO         ;NUEVO     ;SIMON BOLIVAR;5;40;29;170000000;4250000;-75,60690238;6,24675407;2021;6;2
173122;02-06-2021;VENTA           ;APARTAMENTO         ;NUEVO     ;SIMON BOLIVAR;5;64;20;285000000;4453125;-75,60690238;6,24675407;2021;6;2
173133;02-06-2021;VENTA           ;APARTAMENTO         ;NUEVO     ;SANTA TERESITA;4;86;147;315000000;3662791;-75,60855213;6,24224565;2021;6;2
173135;02-06-2021;VENTA           ;APARTAMENTO         ;NUEVO     ;SANTA TERESITA;5;100;193;420000000;4200000;-75,61228294;6,24273468;2021;6;2
173148;02-06-2021;VENTA           ;APARTAMENTO         ;NUEVO     ;BARRIO CRISTOBAL;3;188;230;380000000;2021277;-75,60882531;6,24801422;2021;6;2
173155;02-06-2021;VENTA           ;APARTAMENTO         ;NUEVO     ;EL DANUBIO;4;49;5;150000000;3061224;-75,609783;6,25339546;2021;6;2
173156;02-06-2021;VENTA           ;APARTAMENTO         ;NUEVO     ;EL DANUBIO;4;53;5;190000000;3584906;-75,609783;6,25339546;2021;6;2
173164;02-06-2021;VENTA           ;APARTAMENTO         ;NUEVO     ;SANTA MONICA;4;97;43;298000000;3072165;-75,61353323;6,24992521;2021;6;2
173167;02-06-2021;VENTA           ;APARTAMENTO         ;NUEVO     ;SANTA MONICA;5;100;30;305000000;3050000;-75,61183633;6,24947906;2021;6;2
173172;02-06-2021;VENTA           ;APARTAMENTO         ;NUEVO     ;LA AMERICA;4;80;31;320000000;4000000;-75,60358152;6,25231614;2021;6;2
173173;02-06-2021;VENTA           ;APARTAMENTO         ;NUEVO     ;LA AMERICA;4;82;31;340000000;4146341;-75,60358152;6,25231614;2021;6;2
173181;02-06-2021;VENTA           ;APARTAMENTO         ;NUEVO     ;LA FLORESTA;3;100;27;380000000;3800000;-75,60447233;6,25505124;2021;6;2
173182;02-06-2021;VENTA           ;APARTAMENTO         ;NUEVO     ;LA FLORESTA;3;100;217;380000000;3800000;-75,60429975;6,25481684;2021;6;2
173192;03-06-2021;VENTA           ;APARTAMENTO         ;NUEVO     ;LOS PINOS;4;120;238;675000000;5625000;-75,59731407;6,25451451;2021;6;3
173199;03-06-2021;VENTA           ;APARTAMENTO         ;NUEVO     ;EL DANUBIO;4;65;17;200000000;3076923;-75,60823119;6,25343952;2021;6;3
173200;03-06-2021;VENTA           ;APARTAMENTO         ;NUEVO     ;EL DANUBIO;4;53;10;230000000;4339623;-75,60786913;6,25398668;2021;6;3
173201;03-06-2021;VENTA           ;APARTAMENTO         ;NUEVO     ;EL DANUBIO;4;86;34;290000000;3372093;-75,6099304;6,253277;2021;6;3
173203;03-06-2021;VENTA           ;APARTAMENTO         ;NUEVO     ;LA FLORESTA;4;89;237;300000000;3370787;-75,60278785;6,25471394;2021;6;3
173208;03-06-2021;VENTA           ;APARTAMENTO         ;NUEVO     ;LA FLORESTA;4;47;9;220000000;4680851;-75,59934643;6,25703219;2021;6;3
173209;03-06-2021;VENTA           ;APARTAMENTO         ;NUEVO     ;LA FLORESTA;4;53;9;240000000;4528302;-75,59934643;6,25703219;2021;6;3
173235;03-06-2021;VENTA           ;APARTAMENTO         ;NUEVO     ;CALASANZ;5;115;360;600000000;5217391;-75,59826498;6,26179793;2021;6;3
173238;03-06-2021;VENTA           ;APARTAMENTO         ;NUEVO     ;CALASANZ;5;96;300;616700000;6423958;-75,59880934;6,26280918;2021;6;3
173239;03-06-2021;VENTA           ;APARTAMENTO         ;NUEVO     ;CALASANZ;5;81;300;555410000;6856914;-75,59880934;6,26280918;2021;6;3
173240;03-06-2021;VENTA           ;APARTAMENTO         ;NUEVO     ;CALASANZ;5;74;300;479250000;6476351;-75,59880934;6,26280918;2021;6;3
173248;03-06-2021;VENTA           ;APARTAMENTO         ;NUEVO     ;CALASANZ;6;85;26;475000000;5588235;-75,59958838;6,26076218;2021;6;3
173250;03-06-2021;VENTA           ;APARTAMENTO         ;NUEVO     ;CALASANZ;5;110;30;450000000;4090909;-75,59919766;6,26128944;2021;6;3
173251;03-06-2021;VENTA           ;APARTAMENTO         ;NUEVO     ;CALASANZ;6;120;24;500000000;4166667;-75,5988238;6,26045019;2021;6;3
173253;03-06-2021;VENTA           ;APARTAMENTO         ;NUEVO     ;FERRINI;5;85;252;440000000;5176471;-75,59648805;6,26822654;2021;6;3
173254;03-06-2021;VENTA           ;APARTAMENTO         ;NUEVO     ;FERRINI;5;90;252;450000000;5000000;-75,59648805;6,26822654;2021;6;3
173256;03-06-2021;VENTA           ;APARTAMENTO         ;NUEVO     ;BARRIO CRISTOBAL;5;33;7;137973783;4181024;-75,60998278;6,24821322;2021;6;3
173257;03-06-2021;VENTA           ;APARTAMENTO         ;NUEVO     ;BARRIO CRISTOBAL;5;33;7;170673271;5171917;-75,60998278;6,24821322;2021;6;3
173259;03-06-2021;VENTA           ;APARTAMENTO         ;NUEVO     ;FATIMA;3;46;18;340000000;7391304;-75,58440567;6,2351269;2021;6;3
173260;03-06-2021;VENTA           ;APARTAMENTO         ;NUEVO     ;FATIMA;3;80;192;280000000;3500000;-75,58432686;6,23468564;2021;6;3
173261;03-06-2021;VENTA           ;APARTAMENTO         ;NUEVO     ;FATIMA;3;80;192;280000000;3500000;-75,58432686;6,23468564;2021;6;3
173277;03-06-2021;VENTA           ;APARTAMENTO         ;NUEVO     ;FATIMA;4;115;27;330000000;2869565;-75,58467694;6,23675437;2021;6;3
173280;03-06-2021;VENTA           ;APARTAMENTO         ;NUEVO     ;LA HONDONADA;3;52;23;195000000;3750000;-75,60577377;6,20322176;2021;6;3
173283;03-06-2021;VENTA           ;APARTAMENTO         ;NUEVO     ;LA HONDONADA;4;63;29;200000000;3174603;-75,60443256;6,20320919;2021;6;3
173284;03-06-2021;VENTA           ;APARTAMENTO         ;NUEVO     ;LA HONDONADA;4;62;28;180000000;2903226;-75,60443256;6,20320919;2021;6;3
173291;03-06-2021;VENTA           ;APARTAMENTO         ;NUEVO     ;LA HONDONADA;4;60;30;215000000;3583333;-75,59993901;6,20056141;2021;6;3
173322;03-06-2021;VENTA           ;APARTAMENTO         ;NUEVO     ;ZONA DE EXPANSION BELEN RINCON;5;58;22;290000000;5000000;-75,60730917;6,21163819;2021;6;3
173324;03-06-2021;VENTA           ;APARTAMENTO         ;NUEVO     ;ZONA DE EXPANSION BELEN RINCON;5;55;23;290000000;5272727;-75,60730917;6,21163819;2021;6;3
173325;03-06-2021;VENTA           ;APARTAMENTO         ;NUEVO     ;ZONA DE EXPANSION BELEN RINCON;4;69;23;320000000;4637681;-75,60701107;6,21240198;2021;6;3
173355;03-06-2021;VENTA           ;APARTAMENTO         ;NUEVO     ;ROSALES;5;80;288;438000000;5475000;-75,59267828;6,23815629;2021;6;3
173356;03-06-2021;VENTA           ;APARTAMENTO         ;NUEVO     ;ROSALES;5;80;288;435000000;5437500;-75,59267828;6,23815629;2021;6;3
173367;04-06-2021;VENTA           ;APARTAMENTO         ;NUEVO     ;ROSALES;4;75;28;385000000;5133333;-75,58995349;6,23213486;2021;6;4
173368;04-06-2021;VENTA           ;APARTAMENTO         ;NUEVO     ;ROSALES;4;73;25;380000000;5205479;-75,58995349;6,23213486;2021;6;4
173369;04-06-2021;VENTA           ;APARTAMENTO         ;NUEVO     ;ROSALES;5;100;31;480000000;4800000;-75,59042041;6,23763908;2021;6;4
173370;04-06-2021;VENTA           ;APARTAMENTO         ;NUEVO     ;ROSALES;6;127;24;520000000;4094488;-75,59073354;6,23713843;2021;6;4
173377;04-06-2021;VENTA           ;APARTAMENTO         ;NUEVO     ;ROSALES;6;100;26;500000000;5000000;-75,58843216;6,23809943;2021;6;4
173378;04-06-2021;VENTA           ;APARTAMENTO         ;NUEVO     ;ROSALES;5;111;35;565000000;5090090;-75,58982754;6,23778902;2021;6;4
173379;04-06-2021;VENTA           ;APARTAMENTO         ;NUEVO     ;ROSALES;5;123;37;565000000;4593496;-75,58982754;6,23778902;2021;6;4
173385;04-06-2021;VENTA           ;APARTAMENTO         ;NUEVO     ;FATIMA;4;76;32;270000000;3552632;-75,58577549;6,2333082;2021;6;4
173403;04-06-2021;VENTA           ;APARTAMENTO         ;NUEVO     ;EL NOGAL - LOS ALMENDROS;5;88;30;430000000;4886364;-75,59772687;6,23629694;2021;6;4
173405;04-06-2021;VENTA           ;APARTAMENTO         ;NUEVO     ;ROSALES;5;80;288;475000000;5937500;-75,59267828;6,23815629;2021;6;4
173437;17-06-2021;VENTA           ;APARTAMENTO         ;NUEVO     ;EL NOGAL - LOS ALMENDROS;5;93;0;512000000;5505376;-75,59927608;6,23809206;2021;6;17
173451;17-06-2021;VENTA           ;APARTAMENTO         ;NUEVO     ;LA CASTELLANA;5;98;0;450000000;4591837;-75,60502366;6,23774506;2021;6;17
173455;17-06-2021;VENTA           ;APARTAMENTO         ;NUEVO     ;LAS MERCEDES;5;81;0;400000000;4938272;-75,60992136;6,23855862;2021;6;17
173459;17-06-2021;VENTA           ;APARTAMENTO         ;NUEVO     ;SANTA TERESITA;4;100;0;330000000;3300000;-75,60838601;6,24268529;2021;6;17
173464;17-06-2021;VENTA           ;APARTAMENTO         ;NUEVO     ;SANTA TERESITA;5;138;0;570000000;4130435;-75,61015062;6,24353018;2021;6;17
173466;17-06-2021;VENTA           ;APARTAMENTO         ;NUEVO     ;SANTA TERESITA;5;80;0;440000000;5500000;-75,61228294;6,24273468;2021;6;17
173469;17-06-2021;VENTA           ;APARTAMENTO         ;NUEVO     ;SANTA TERESITA;5;40;0;175000000;4375000;-75,61233094;6,24390653;2021;6;17
173484;17-06-2021;VENTA           ;APARTAMENTO         ;NUEVO     ;SIMON BOLIVAR;5;112;0;548000000;4892857;-75,60586696;6,24691215;2021;6;17
173485;17-06-2021;VENTA           ;APARTAMENTO         ;NUEVO     ;SIMON BOLIVAR;5;155;0;576000000;3716129;-75,60586696;6,24691215;2021;6;17
173486;17-06-2021;VENTA           ;APARTAMENTO         ;NUEVO     ;SIMON BOLIVAR;5;90;0;330000000;3666667;-75,60690238;6,24675407;2021;6;17
173488;17-06-2021;VENTA           ;APARTAMENTO         ;NUEVO     ;LA CASTELLANA;5;100;0;430000000;4300000;-75,60690031;6,23923691;2021;6;17
173489;17-06-2021;VENTA           ;APARTAMENTO         ;NUEVO     ;LA CASTELLANA;5;115;0;420000000;3652174;-75,60650197;6,23935828;2021;6;17
173490;17-06-2021;VENTA           ;APARTAMENTO         ;NUEVO     ;LA CASTELLANA;5;115;0;440000000;3826087;-75,60650197;6,23935828;2021;6;17
173491;17-06-2021;VENTA           ;APARTAMENTO         ;NUEVO     ;LA CASTELLANA;5;95;0;430000000;4526316;-75,60696437;6,23997774;2021;6;17
173497;17-06-2021;VENTA           ;APARTAMENTO         ;NUEVO     ;LA CASTELLANA;5;105;0;574000000;5466667;-75,60652433;6,24184184;2021;6;17
173498;17-06-2021;VENTA           ;APARTAMENTO         ;NUEVO     ;LA CASTELLANA;5;172;0;790000000;4593023;-75,60652433;6,24184184;2021;6;17
173502;17-06-2021;VENTA           ;APARTAMENTO         ;NUEVO     ;LA CASTELLANA;6;100;0;485000000;4850000;-75,60504859;6,24078171;2021;6;17
173503;17-06-2021;VENTA           ;APARTAMENTO         ;NUEVO     ;LA CASTELLANA;6;117;0;550000000;4700855;-75,60490531;6,23954596;2021;6;17
173505;17-06-2021;VENTA           ;APARTAMENTO         ;NUEVO     ;LA CASTELLANA;5;100;0;448500000;4485000;-75,6049032;6,23965344;2021;6;17
173507;17-06-2021;VENTA           ;APARTAMENTO         ;NUEVO     ;LA CASTELLANA;5;117;0;590000000;5042735;-75,60375238;6,24077911;2021;6;17
173508;17-06-2021;VENTA           ;APARTAMENTO         ;NUEVO     ;LA CASTELLANA;5;119;0;630000000;5294118;-75,60375238;6,24077911;2021;6;17
173509;17-06-2021;VENTA           ;APARTAMENTO         ;NUEVO     ;LA CASTELLANA;5;125;0;680000000;5440000;-75,60375238;6,24077911;2021;6;17
173510;17-06-2021;VENTA           ;APARTAMENTO         ;NUEVO     ;LA CASTELLANA;5;100;25;460000000;4600000;-75,60337162;6,24265716;2021;6;17
173511;17-06-2021;VENTA           ;APARTAMENTO         ;NUEVO     ;LA CASTELLANA;5;100;25;450000000;4500000;-75,60337162;6,24265716;2021;6;17
173512;17-06-2021;VENTA           ;APARTAMENTO         ;NUEVO     ;LA CASTELLANA;5;115;0;400000000;3478261;-75,60329236;6,24263686;2021;6;17
173521;17-06-2021;VENTA           ;APARTAMENTO         ;NUEVO     ;LA CASTELLANA;5;105;22;450000000;4285714;-75,60495837;6,24309209;2021;6;17
173524;17-06-2021;VENTA           ;APARTAMENTO         ;NUEVO     ;LA CASTELLANA;5;134;0;510000000;3805970;-75,60495153;6,24163708;2021;6;17
173525;17-06-2021;VENTA           ;APARTAMENTO         ;NUEVO     ;LA CASTELLANA;5;145;0;560000000;3862069;-75,60495153;6,24163708;2021;6;17
173535;17-06-2021;VENTA           ;APARTAMENTO         ;NUEVO     ;SIMON BOLIVAR;5;185;0;440000000;2378378;-75,60441315;6,24812356;2021;6;17
173539;17-06-2021;VENTA           ;APARTAMENTO         ;NUEVO     ;MIRAVALLE;5;87;0;450000000;5172414;-75,60219002;6,23635629;2021;6;17
173545;17-06-2021;VENTA           ;APARTAMENTO         ;NUEVO     ;EL NOGAL - LOS ALMENDROS;5;93;0;430000000;4623656;-75,59772687;6,23629694;2021;6;17
173546;17-06-2021;VENTA           ;APARTAMENTO         ;NUEVO     ;EL NOGAL - LOS ALMENDROS;5;93;0;515000000;5537634;-75,59927608;6,23809206;2021;6;17
173547;17-06-2021;VENTA           ;APARTAMENTO         ;NUEVO     ;EL NOGAL - LOS ALMENDROS;5;161;0;650000000;4037267;-75,59927608;6,23809206;2021;6;17
173548;17-06-2021;VENTA           ;APARTAMENTO         ;NUEVO     ;EL NOGAL - LOS ALMENDROS;5;44;23;219000000;4977273;-75,59786675;6,23850814;2021;6;17
173549;17-06-2021;VENTA           ;APARTAMENTO         ;NUEVO     ;EL NOGAL - LOS ALMENDROS;6;41;0;293000000;7146341;-75,59537157;6,23806158;2021;6;17
173550;17-06-2021;VENTA           ;APARTAMENTO         ;NUEVO     ;EL NOGAL - LOS ALMENDROS;5;102;0;689000000;6754902;-75,59537157;6,23806158;2021;6;17
173551;17-06-2021;VENTA           ;APARTAMENTO         ;NUEVO     ;EL NOGAL - LOS ALMENDROS;5;122;0;810000000;6639344;-75,59537157;6,23806158;2021;6;17
173552;17-06-2021;VENTA           ;APARTAMENTO         ;NUEVO     ;EL NOGAL - LOS ALMENDROS;5;134;0;852000000;6358209;-75,59537157;6,23806158;2021;6;17
173561;17-06-2021;VENTA           ;APARTAMENTO         ;NUEVO     ;ROSALES;6;82;0;350000000;4268293;-75,59073354;6,23713843;2021;6;17
173562;17-06-2021;VENTA           ;APARTAMENTO         ;NUEVO     ;ROSALES;6;120;0;500000000;4166667;-75,59073354;6,23713843;2021;6;17
173563;17-06-2021;VENTA           ;APARTAMENTO         ;NUEVO     ;ROSALES;6;127;0;490000000;3858268;-75,59073354;6,23713843;2021;6;17
173583;17-06-2021;VENTA           ;APARTAMENTO         ;NUEVO     ;LAURELES;5;99;0;575000000;5808081;-75,59627275;6,23988723;2021;6;17
173584;17-06-2021;VENTA           ;APARTAMENTO         ;NUEVO     ;LAURELES;5;105;0;600000000;5714286;-75,59627275;6,23988723;2021;6;17
173595;17-06-2021;VENTA           ;APARTAMENTO         ;NUEVO     ;CARLOS E. RESTREPO;4;110;0;495000000;4500000;-75,58078258;6,25821878;2021;6;17
173620;17-06-2021;VENTA           ;APARTAMENTO         ;NUEVO     ;EL ESTADIO;5;82;0;459400000;5602439;-75,5958078;6,25902912;2021;6;17
173626;17-06-2021;VENTA           ;APARTAMENTO         ;NUEVO     ;EL ESTADIO;6;118;0;420000000;3559322;-75,59538734;6,26117852;2021;6;17
173635;17-06-2021;VENTA           ;APARTAMENTO         ;NUEVO     ;EL ESTADIO;5;230;0;430000000;1869565;-75,59204747;6,2596681;2021;6;17
173637;17-06-2021;VENTA           ;APARTAMENTO         ;NUEVO     ;EL ESTADIO;4;90;0;465000000;5166667;-75,59307783;6,26030891;2021;6;17
173643;17-06-2021;VENTA           ;APARTAMENTO         ;NUEVO     ;SURAMERICANA;5;62;0;320000000;5161290;-75,58079366;6,25559939;2021;6;17
173669;17-06-2021;VENTA           ;APARTAMENTO         ;NUEVO     ;BOLIVARIANA;5;32;0;200000000;6250000;-75,58944322;6,24763042;2021;6;17
173670;17-06-2021;VENTA           ;APARTAMENTO         ;NUEVO     ;BOLIVARIANA;5;34;0;240000000;7058824;-75,58944322;6,24763042;2021;6;17
173674;17-06-2021;VENTA           ;APARTAMENTO         ;NUEVO     ;BOLIVARIANA;5;220;0;690000000;3136364;-75,59111286;6,24669362;2021;6;17
173688;17-06-2021;VENTA           ;APARTAMENTO         ;NUEVO     ;LORENA;5;106;0;654000000;6169811;-75,59424489;6,24869772;2021;6;17
173689;17-06-2021;VENTA           ;APARTAMENTO         ;NUEVO     ;LORENA;5;106;0;668000000;6301887;-75,59424489;6,24869772;2021;6;17
173709;17-06-2021;VENTA           ;APARTAMENTO         ;NUEVO     ;LAURELES;5;100;0;550000000;5500000;-75,59272734;6,24180019;2021;6;17
173712;17-06-2021;VENTA           ;APARTAMENTO         ;NUEVO     ;LORENA;4;55;0;230000000;4181818;-75,5957383;6,24965269;2021;6;17
173713;17-06-2021;VENTA           ;APARTAMENTO         ;NUEVO     ;LORENA;4;55;0;220000000;4000000;-75,5957383;6,24965269;2021;6;17
173714;17-06-2021;VENTA           ;APARTAMENTO         ;NUEVO     ;LORENA;4;55;0;290000000;5272727;-75,5957383;6,24965269;2021;6;17
173715;17-06-2021;VENTA           ;APARTAMENTO         ;NUEVO     ;BOLIVARIANA;6;94;0;520000000;5531915;-75,59251803;6,24476771;2021;6;17
173723;17-06-2021;VENTA           ;APARTAMENTO         ;NUEVO     ;LAURELES;5;162;0;1092220500;6742102;-75,59316391;6,24542057;2021;6;17
173744;17-06-2021;VENTA           ;APARTAMENTO         ;NUEVO     ;CASTROPOL;6;64;0;486000000;7593750;-75,56897198;6,22134469;2021;6;17
173745;17-06-2021;VENTA           ;APARTAMENTO         ;NUEVO     ;CASTROPOL;6;73;0;524000000;7178082;-75,56897198;6,22134469;2021;6;17
173746;17-06-2021;VENTA           ;APARTAMENTO         ;NUEVO     ;CASTROPOL;6;86;0;628000000;7302326;-75,56897198;6,22134469;2021;6;17
173747;17-06-2021;VENTA           ;APARTAMENTO         ;NUEVO     ;CASTROPOL;6;104;0;748000000;7192308;-75,56897198;6,22134469;2021;6;17
173749;17-06-2021;VENTA           ;APARTAMENTO         ;NUEVO     ;CASTROPOL;6;118;0;836872000;7092136;-75,56897198;6,22134469;2021;6;17
173750;17-06-2021;VENTA           ;APARTAMENTO         ;NUEVO     ;CASTROPOL;6;120;0;851485000;7095708;-75,56897198;6,22134469;2021;6;17
173786;17-06-2021;VENTA           ;APARTAMENTO         ;NUEVO     ;EL TESORO;6;230;0;1580000000;6869565;-75,55215223;6,20237814;2021;6;17
173787;17-06-2021;VENTA           ;APARTAMENTO         ;NUEVO     ;EL TESORO;6;240;0;1687000000;7029167;-75,55215223;6,20237814;2021;6;17
173788;17-06-2021;VENTA           ;APARTAMENTO         ;NUEVO     ;EL TESORO;6;240;0;1650000000;6875000;-75,55215223;6,20237814;2021;6;17
173789;17-06-2021;VENTA           ;APARTAMENTO         ;NUEVO     ;LOS BALSOS # 2;5;108;0;771000000;7138889;-75,57058318;6,19469456;2021;6;17
173797;17-06-2021;VENTA           ;APARTAMENTO         ;NUEVO     ;ALTOS DEL POBLADO;6;113;0;906000000;8017699;-75,55730554;6,21640575;2021;6;17
173798;17-06-2021;VENTA           ;APARTAMENTO         ;NUEVO     ;ASOMADERA # 3;6;87;0;785000000;9022989;-75,55742432;6,21833837;2021;6;17
173799;17-06-2021;VENTA           ;APARTAMENTO         ;NUEVO     ;ASOMADERA # 3;6;96;0;915000000;9531250;-75,55742432;6,21833837;2021;6;17
173800;17-06-2021;VENTA           ;APARTAMENTO         ;NUEVO     ;ASOMADERA # 3;6;133;0;1250000000;9398496;-75,55742432;6,21833837;2021;6;17
173801;17-06-2021;VENTA           ;APARTAMENTO         ;NUEVO     ;ALTOS DEL POBLADO;6;326;0;1960000000;6012270;-75,54809698;6,20880409;2021;6;17
173817;17-06-2021;VENTA           ;APARTAMENTO         ;NUEVO     ;LALINDE;6;88;0;750000000;8522727;-75,56813568;6,21244258;2021;6;17
173819;17-06-2021;VENTA           ;APARTAMENTO         ;NUEVO     ;SANTA MARIA DE LOS ANGELES;6;195;0;1296000000;6646154;-75,57909708;6,18908157;2021;6;17
173823;17-06-2021;VENTA           ;APARTAMENTO         ;NUEVO     ;SANTA MARIA DE LOS ANGELES;6;55;0;380800000;6923636;-75,57903554;6,1865984;2021;6;17
173825;17-06-2021;VENTA           ;APARTAMENTO         ;NUEVO     ;SANTA MARIA DE LOS ANGELES;3;141;0;918800000;6516312;-75,57903554;6,1865984;2021;6;17
173829;17-06-2021;VENTA           ;APARTAMENTO         ;NUEVO     ;LOS BALSOS # 1;6;199;0;1100000000;5527638;-75,56577245;6,1881761;2021;6;17
173830;17-06-2021;VENTA           ;APARTAMENTO         ;NUEVO     ;LOS BALSOS # 1;6;204;0;1070000000;5245098;-75,56577245;6,1881761;2021;6;17
173838;17-06-2021;VENTA           ;APARTAMENTO         ;NUEVO     ;LOS BALSOS # 1;6;209;0;1600000000;7655502;-75,55761529;6,18238468;2021;6;17
173839;17-06-2021;VENTA           ;APARTAMENTO         ;NUEVO     ;LOS BALSOS # 1;6;267;0;2100000000;7865169;-75,55761529;6,18238468;2021;6;17
173840;17-06-2021;VENTA           ;APARTAMENTO         ;NUEVO     ;LOS BALSOS # 1;6;311;0;2400000000;7717042;-75,55761529;6,18238468;2021;6;17
173841;17-06-2021;VENTA           ;APARTAMENTO         ;NUEVO     ;LOS BALSOS # 1;6;279;0;2150000000;7706093;-75,55761529;6,18238468;2021;6;17
173842;17-06-2021;VENTA           ;APARTAMENTO         ;NUEVO     ;LOS BALSOS # 1;6;320;0;2420000000;7562500;-75,55761529;6,18238468;2021;6;17
173845;17-06-2021;VENTA           ;APARTAMENTO         ;NUEVO     ;ALEJANDRIA;6;89;0;699646000;7861191;-75,5696523;6,2022221;2021;6;17
173846;17-06-2021;VENTA           ;APARTAMENTO         ;NUEVO     ;ALEJANDRIA;6;171;0;1428000000;8350877;-75,5696523;6,2022221;2021;6;17
173847;17-06-2021;VENTA           ;APARTAMENTO         ;NUEVO     ;ALEJANDRIA;6;121;0;948804000;7841355;-75,5696523;6,2022221;2021;6;17
173848;17-06-2021;VENTA           ;APARTAMENTO         ;NUEVO     ;ALEJANDRIA;6;125;0;970130000;7761040;-75,5696523;6,2022221;2021;6;17
173850;17-06-2021;VENTA           ;APARTAMENTO         ;NUEVO     ;LOS BALSOS # 1;6;263;0;1490000000;5665399;-75,55720567;6,18504383;2021;6;17
173851;17-06-2021;VENTA           ;APARTAMENTO         ;NUEVO     ;LOS BALSOS # 1;6;250;0;1550000000;6200000;-75,55720567;6,18504383;2021;6;17
173857;17-06-2021;VENTA           ;APARTAMENTO         ;NUEVO     ;CALASANZ;5;114;0;550000000;4824561;-75,59809216;6,26186243;2021;6;17
173858;17-06-2021;VENTA           ;APARTAMENTO         ;NUEVO     ;CALASANZ;5;115;0;550000000;4782609;-75,59826498;6,26179793;2021;6;17
173860;17-06-2021;VENTA           ;APARTAMENTO         ;NUEVO     ;LAS ACACIAS;5;120;0;750000000;6250000;-75,59973482;6,24362393;2021;6;17
173874;17-06-2021;VENTA           ;APARTAMENTO         ;NUEVO     ;LAURELES;6;134;0;796000000;5940299;-75,59760654;6,24179686;2021;6;17
173878;17-06-2021;VENTA           ;APARTAMENTO         ;NUEVO     ;LAS ACACIAS;5;101;0;585000000;5792079;-75,59858883;6,24106668;2021;6;17
173887;17-06-2021;VENTA           ;APARTAMENTO         ;NUEVO     ;LAS ACACIAS;5;115;0;590000000;5130435;-75,60250948;6,23941175;2021;6;17
173891;17-06-2021;VENTA           ;APARTAMENTO         ;NUEVO     ;LA CASTELLANA;5;87;0;410000000;4712644;-75,60318095;6,24165474;2021;6;17
173894;17-06-2021;VENTA           ;APARTAMENTO         ;NUEVO     ;LAS ACACIAS;5;104;0;510000000;4903846;-75,59996942;6,2419669;2021;6;17
173895;17-06-2021;VENTA           ;APARTAMENTO         ;NUEVO     ;LAURELES;5;92;0;525000000;5706522;-75,59534764;6,23941326;2021;6;17
173902;17-06-2021;VENTA           ;APARTAMENTO         ;NUEVO     ;LAURELES;5;99;0;602000000;6080808;-75,59330542;6,24060995;2021;6;17
173905;17-06-2021;VENTA           ;APARTAMENTO         ;NUEVO     ;LAURELES;5;105;0;600000000;5714286;-75,59627275;6,23988723;2021;6;17
173909;17-06-2021;VENTA           ;APARTAMENTO         ;NUEVO     ;LAURELES;5;100;0;550000000;5500000;-75,59272734;6,24180019;2021;6;17
173911;17-06-2021;VENTA           ;APARTAMENTO         ;NUEVO     ;LAURELES;5;63;0;400000000;6349206;-75,59272734;6,24180019;2021;6;17
173918;17-06-2021;VENTA           ;APARTAMENTO         ;NUEVO     ;LOS CONQUISTADORES;5;83;28;500000000;6024096;-75,58518647;6,24299622;2021;6;17
173923;17-06-2021;VENTA           ;APARTAMENTO         ;NUEVO     ;LOS CONQUISTADORES;6;115;0;490000000;4260870;-75,58493947;6,24111294;2021;6;17
173924;17-06-2021;VENTA           ;APARTAMENTO         ;NUEVO     ;LOS CONQUISTADORES;5;126;0;450000000;3571429;-75,58517755;6,23971535;2021;6;17
173928;17-06-2021;VENTA           ;APARTAMENTO         ;NUEVO     ;LOS CONQUISTADORES;5;120;0;559900000;4665833;-75,58250971;6,24430182;2021;6;17
173957;17-06-2021;VENTA           ;APARTAMENTO         ;NUEVO     ;LOS COLORES;5;96;0;480000000;5000000;-75,59606981;6,2642847;2021;6;17
173961;17-06-2021;VENTA           ;APARTAMENTO         ;NUEVO     ;SAN GERMAN;4;71;0;380000000;5352113;-75,59115262;6,2689484;2021;6;17
173969;17-06-2021;VENTA           ;APARTAMENTO         ;NUEVO     ;LOS CONQUISTADORES;5;100;0;450000000;4500000;-75,58241923;6,24556034;2021;6;17
173970;17-06-2021;VENTA           ;APARTAMENTO         ;NUEVO     ;LOS CONQUISTADORES;5;61;0;280000000;4590164;-75,58221881;6,24636657;2021;6;17
173974;17-06-2021;VENTA           ;APARTAMENTO         ;NUEVO     ;LOS CONQUISTADORES;5;97;0;510000000;5257732;-75,58153239;6,24354062;2021;6;17
173979;17-06-2021;VENTA           ;APARTAMENTO         ;NUEVO     ;LOS CONQUISTADORES;5;116;0;585000000;5043103;-75,58209427;6,24312658;2021;6;17
173980;17-06-2021;VENTA           ;APARTAMENTO         ;NUEVO     ;LOS CONQUISTADORES;5;116;0;708000000;6103448;-75,58209427;6,24312658;2021;6;17
174001;17-06-2021;VENTA           ;APARTAMENTO         ;NUEVO     ;ALTOS DEL POBLADO;6;87;0;490000000;5632184;-75,55663744;6,21639557;2021;6;17
174003;17-06-2021;VENTA           ;APARTAMENTO         ;NUEVO     ;ALTOS DEL POBLADO;6;86;0;460000000;5348837;-75,55663744;6,21639557;2021;6;17
174004;17-06-2021;VENTA           ;APARTAMENTO         ;NUEVO     ;ZONA EXPANSION ALTOS DE CALASANZ;4;62;0;259000000;4177419;-75,60565577;6,26941095;2021;6;17
174005;17-06-2021;VENTA           ;APARTAMENTO         ;NUEVO     ;ASOMADERA # 3;6;87;0;786274825;9037642;-75,55742432;6,21833837;2021;6;17
174006;17-06-2021;VENTA           ;APARTAMENTO         ;NUEVO     ;ASOMADERA # 3;6;281;0;2435064170;8665709;-75,55742432;6,21833837;2021;6;17
174010;17-06-2021;VENTA           ;APARTAMENTO         ;NUEVO     ;ASOMADERA # 3;6;99;0;907772355;9169418;-75,55742432;6,21833837;2021;6;17
174011;17-06-2021;VENTA           ;APARTAMENTO         ;NUEVO     ;ASOMADERA # 3;6;137;0;1243626720;9077567;-75,55742432;6,21833837;2021;6;17
174025;17-06-2021;VENTA           ;APARTAMENTO         ;NUEVO     ;EL TESORO;6;230;0;1665000000;7239130;-75,55328607;6,19931885;2021;6;17
174027;17-06-2021;VENTA           ;APARTAMENTO         ;NUEVO     ;EL TESORO;6;240;0;1687000000;7029167;-75,55328607;6,19931885;2021;6;17
174028;17-06-2021;VENTA           ;APARTAMENTO         ;NUEVO     ;EL TESORO;6;246;0;1812000000;7365854;-75,55328607;6,19931885;2021;6;17
174034;17-06-2021;VENTA           ;APARTAMENTO         ;NUEVO     ;ALTOS DEL POBLADO;6;298;0;2059000000;6909396;-75,55039698;6,21126582;2021;6;17
174035;17-06-2021;VENTA           ;APARTAMENTO         ;NUEVO     ;ALTOS DEL POBLADO;6;255;0;1816000000;7121569;-75,55039698;6,21126582;2021;6;17
174037;17-06-2021;VENTA           ;APARTAMENTO         ;NUEVO     ;ALTOS DEL POBLADO;6;96;0;375000000;3906250;-75,5478588;6,21237529;2021;6;17
174047;17-06-2021;VENTA           ;APARTAMENTO         ;NUEVO     ;LALINDE;6;178;0;950000000;5337079;-75,56517666;6,21287343;2021;6;17
174048;17-06-2021;VENTA           ;APARTAMENTO         ;NUEVO     ;LALINDE;6;172;0;980000000;5697674;-75,56517666;6,21287343;2021;6;17
174053;17-06-2021;VENTA           ;APARTAMENTO         ;NUEVO     ;LALINDE;6;96;0;660000000;6875000;-75,56813568;6,21244258;2021;6;17
174054;17-06-2021;VENTA           ;APARTAMENTO         ;NUEVO     ;LALINDE;6;108;0;740000000;6851852;-75,56813568;6,21244258;2021;6;17
174055;17-06-2021;VENTA           ;APARTAMENTO         ;NUEVO     ;LALINDE;6;107;64;750000000;7009346;-75,56813568;6,21244258;2021;6;17
174056;17-06-2021;VENTA           ;APARTAMENTO         ;NUEVO     ;LALINDE;6;97;0;750000000;7731959;-75,56813568;6,21244258;2021;6;17
174057;17-06-2021;VENTA           ;APARTAMENTO         ;NUEVO     ;LALINDE;6;158;0;1125000000;7120253;-75,56813568;6,21244258;2021;6;17
174061;17-06-2021;VENTA           ;APARTAMENTO         ;NUEVO     ;CASTROPOL;6;157;0;890000000;5668790;-75,56506693;6,21630167;2021;6;17
174080;17-06-2021;VENTA           ;APARTAMENTO         ;NUEVO     ;ASOMADERA # 1;4;87;0;410000000;4712644;-75,56163878;6,22553157;2021;6;17
174082;17-06-2021;VENTA           ;APARTAMENTO         ;NUEVO     ;CASTROPOL;6;103;0;670000000;6504854;-75,56669945;6,2238144;2021;6;17
174083;17-06-2021;VENTA           ;APARTAMENTO         ;NUEVO     ;CASTROPOL;6;92;0;520000000;5652174;-75,56669945;6,2238144;2021;6;17
174092;17-06-2021;VENTA           ;APARTAMENTO         ;NUEVO     ;VILLA CARLOTA;5;120;0;720000000;6000000;-75,5743556;6,22057823;2021;6;17
174152;17-06-2021;VENTA           ;APARTAMENTO         ;NUEVO     ;LA AGUACATALA;6;139;0;840000000;6043165;-75,57677985;6,19560984;2021;6;17
174160;17-06-2021;VENTA           ;APARTAMENTO         ;NUEVO     ;SANTA MARIA DE LOS ANGELES;6;229;0;750000000;3275109;-75,57823703;6,19334248;2021;6;17
174164;17-06-2021;VENTA           ;APARTAMENTO         ;NUEVO     ;SANTA MARIA DE LOS ANGELES;6;107;0;620000000;5794393;-75,57884126;6,19126493;2021;6;17
174165;17-06-2021;VENTA           ;APARTAMENTO         ;NUEVO     ;SANTA MARIA DE LOS ANGELES;6;107;0;630000000;5887850;-75,57884126;6,19126493;2021;6;17
174170;17-06-2021;VENTA           ;APARTAMENTO         ;NUEVO     ;SANTA MARIA DE LOS ANGELES;6;106;0;630000000;5943396;-75,57736094;6,1928363;2021;6;17
174171;17-06-2021;VENTA           ;APARTAMENTO         ;NUEVO     ;SANTA MARIA DE LOS ANGELES;6;131;0;700000000;5343511;-75,57786667;6,19310056;2021;6;17
174185;17-06-2021;VENTA           ;APARTAMENTO         ;NUEVO     ;EL CASTILLO;6;302;0;1900000000;6291391;-75,57171321;6,19192601;2021;6;17
174203;17-06-2021;VENTA           ;APARTAMENTO         ;NUEVO     ;ALTOS DEL POBLADO;6;165;0;1258000000;7624242;-75,54973895;6,21061381;2021;6;17
174206;17-06-2021;VENTA           ;APARTAMENTO         ;NUEVO     ;CASTROPOL;6;93;0;550000000;5913978;-75,56773642;6,22031672;2021;6;17
174207;17-06-2021;VENTA           ;APARTAMENTO         ;NUEVO     ;LALINDE;6;114;0;800000000;7017544;-75,56509552;6,21429568;2021;6;17
174216;17-06-2021;VENTA           ;APARTAMENTO         ;NUEVO     ;SAN JOAQUIN;5;87;0;395000000;4540230;-75,58703073;6,24383976;2021;6;17
174222;17-06-2021;VENTA           ;APARTAMENTO         ;NUEVO     ;SAN JOAQUIN;4;75;0;380000000;5066667;-75,58508735;6,24548559;2021;6;17
174223;17-06-2021;VENTA           ;APARTAMENTO         ;NUEVO     ;SAN JOAQUIN;4;87;0;430000000;4942529;-75,58508735;6,24548559;2021;6;17
174232;17-06-2021;VENTA           ;APARTAMENTO         ;NUEVO     ;NARANJAL;5;90;0;410000000;4555556;-75,58268319;6,25056864;2021;6;17
174246;17-06-2021;VENTA           ;APARTAMENTO         ;NUEVO     ;EL VELODROMO;5;203;0;750000000;3694581;-75,59563509;6,25557718;2021;6;17
174251;17-06-2021;VENTA           ;APARTAMENTO         ;NUEVO     ;CALASANZ;5;120;0;480000000;4000000;-75,59845571;6,26472813;2021;6;17
174253;17-06-2021;VENTA           ;APARTAMENTO         ;NUEVO     ;ALEJANDRIA;6;89;0;700000000;7865169;-75,5696523;6,2022221;2021;6;17
174254;17-06-2021;VENTA           ;APARTAMENTO         ;NUEVO     ;ALEJANDRIA;6;125;0;970130000;7761040;-75,5696523;6,2022221;2021;6;17
174259;17-06-2021;VENTA           ;APARTAMENTO         ;NUEVO     ;LOS BALSOS # 1;6;67;0;510000000;7611940;-75,56600069;6,19061392;2021;6;17
174260;17-06-2021;VENTA           ;APARTAMENTO         ;NUEVO     ;LOS BALSOS # 1;5;199;0;1100000000;5527638;-75,56547162;6,18732398;2021;6;17
174261;17-06-2021;VENTA           ;APARTAMENTO         ;NUEVO     ;LOS BALSOS # 1;6;204;0;1070000000;5245098;-75,56577245;6,1881761;2021;6;17
174271;17-06-2021;VENTA           ;APARTAMENTO         ;NUEVO     ;ALEJANDRIA;6;125;0;650000000;5200000;-75,57025859;6,20200072;2021;6;17
174273;17-06-2021;VENTA           ;APARTAMENTO         ;NUEVO     ;ALEJANDRIA;6;190;0;720000000;3789474;-75,57025859;6,20200072;2021;6;17
174275;17-06-2021;VENTA           ;APARTAMENTO         ;NUEVO     ;ALEJANDRIA;6;143;0;930000000;6503497;-75,57071484;6,20220021;2021;6;17
174302;17-06-2021;VENTA           ;APARTAMENTO         ;NUEVO     ;CALASANZ;5;248;0;390000000;1572581;-75,59961309;6,26065655;2021;6;17
174333;17-06-2021;VENTA           ;APARTAMENTO         ;NUEVO     ;FLORIDA NUEVA;5;120;0;600000000;5000000;-75,59262992;6,25259908;2021;6;17
174339;17-06-2021;VENTA           ;APARTAMENTO         ;NUEVO     ;EL VELODROMO;6;122;0;480000000;3934426;-75,59478488;6,25172479;2021;6;17
174340;17-06-2021;VENTA           ;APARTAMENTO         ;NUEVO     ;LOS PINOS;4;81;0;489705000;6045741;-75,59693825;6,25091185;2021;6;17
174341;17-06-2021;VENTA           ;APARTAMENTO         ;NUEVO     ;LOS PINOS;4;97;0;557690000;5749381;-75,59693825;6,25091185;2021;6;17
174342;17-06-2021;VENTA           ;APARTAMENTO         ;NUEVO     ;LOS PINOS;4;99;0;570370000;5761313;-75,59693825;6,25091185;2021;6;17
174343;17-06-2021;VENTA           ;APARTAMENTO         ;NUEVO     ;LOS PINOS;4;155;0;890000000;5741935;-75,59693825;6,25091185;2021;6;17
174347;17-06-2021;VENTA           ;APARTAMENTO         ;NUEVO     ;LOS PINOS;4;70;0;240000000;3428571;-75,5969032;6,25128621;2021;6;17
174372;17-06-2021;VENTA           ;APARTAMENTO         ;NUEVO     ;LA FLORESTA;4;95;0;380000000;4000000;-75,59869256;6,25576668;2021;6;17
174378;17-06-2021;VENTA           ;APARTAMENTO         ;NUEVO     ;EL VELODROMO;6;91;0;420000000;4615385;-75,59719029;6,25528953;2021;6;17
174379;17-06-2021;VENTA           ;APARTAMENTO         ;NUEVO     ;EL VELODROMO;5;127;0;782000000;6157480;-75,59712613;6,25658597;2021;6;17
174380;17-06-2021;VENTA           ;APARTAMENTO         ;NUEVO     ;EL VELODROMO;5;87;0;544000000;6252874;-75,59712613;6,25658597;2021;6;17
174382;17-06-2021;VENTA           ;APARTAMENTO         ;NUEVO     ;EL VELODROMO;6;90;0;430000000;4777778;-75,59747612;6,25690929;2021;6;17
174413;17-06-2021;VENTA           ;APARTAMENTO         ;NUEVO     ;ALEJANDRIA;6;206;0;870000000;4223301;-75,57139539;6,20026719;2021;6;17
174415;17-06-2021;VENTA           ;APARTAMENTO         ;NUEVO     ;PATIO BONITO;6;233;0;986000000;4231760;-75,57352908;6,20490742;2021;6;17
174416;17-06-2021;VENTA           ;APARTAMENTO         ;NUEVO     ;ALTOS DEL POBLADO;6;84;0;420000000;5000000;-75,55654621;6,21464788;2021;6;17
174417;17-06-2021;VENTA           ;APARTAMENTO         ;NUEVO     ;LOS BALSOS # 1;6;201;0;1500000000;7462687;-75,55761529;6,18238468;2021;6;17
174418;17-06-2021;VENTA           ;APARTAMENTO         ;NUEVO     ;ASOMADERA # 2;6;116;0;590000000;5086207;-75,55995767;6,21710994;2021;6;17
174420;17-06-2021;VENTA           ;APARTAMENTO         ;NUEVO     ;CASTROPOL;6;120;0;740000000;6166667;-75,56773642;6,22031672;2021;6;17
174424;17-06-2021;VENTA           ;APARTAMENTO         ;NUEVO     ;LALINDE;6;65;0;365000000;5615385;-75,56927015;6,2118885;2021;6;17
174426;17-06-2021;VENTA           ;APARTAMENTO         ;NUEVO     ;ALTOS DEL POBLADO;6;257;0;1680000000;6536965;-75,54809698;6,20880409;2021;6;17
174435;17-06-2021;VENTA           ;APARTAMENTO         ;NUEVO     ;CASTROPOL;6;79;0;600000000;7594937;-75,56537037;6,21529852;2021;6;17
174436;17-06-2021;VENTA           ;APARTAMENTO         ;NUEVO     ;LAS LOMAS # 2;6;156;0;900000000;5769231;-75,55816479;6,21188033;2021;6;17
174437;17-06-2021;VENTA           ;APARTAMENTO         ;NUEVO     ;EL TESORO;6;106;0;630000000;5943396;-75,55066429;6,20599634;2021;6;17
174835;17-06-2021;VENTA           ;APARTAMENTO         ;NUEVO     ;EL VELODROMO;6;122;0;480000000;3934426;-75,59478488;6,25172479;2021;6;17
174853;17-06-2021;VENTA           ;APARTAMENTO         ;NUEVO     ;LOS CONQUISTADORES;6;95;0;410000000;4315789;-75,58065042;6,24465382;2021;6;17
174884;17-06-2021;VENTA           ;APARTAMENTO         ;NUEVO     ;VILLA CARLOTA;5;72;0;450000000;6250000;-75,5743556;6,22057823;2021;6;17
174889;17-06-2021;VENTA           ;APARTAMENTO         ;NUEVO     ;LOS BALSOS # 1;6;125;0;800000000;6400000;-75,56547162;6,18732398;2021;6;17
174909;17-06-2021;VENTA           ;APARTAMENTO         ;NUEVO     ;EL CASTILLO;6;175;0;1430000000;8171429;-75,57271526;6,19043159;2021;6;17
174927;17-06-2021;VENTA           ;APARTAMENTO         ;NUEVO     ;SANTA MARIA DE LOS ANGELES;6;70;0;280000000;4000000;-75,58157495;6,18866809;2021;6;17
175000;17-06-2021;VENTA           ;APARTAMENTO         ;NUEVO     ;ALTOS DEL POBLADO;6;86;27;500000000;5813953;-75,55663744;6,21639557;2021;6;17
175004;17-06-2021;VENTA           ;APARTAMENTO         ;NUEVO     ;ALTOS DEL POBLADO;6;67;19;377551000;5635090;-75,55663744;6,21639557;2021;6;17
175012;17-06-2021;VENTA           ;APARTAMENTO         ;NUEVO     ;CASTROPOL;6;81;24;480000000;5925926;-75,56714671;6,21981325;2021;6;17
175013;17-06-2021;VENTA           ;APARTAMENTO         ;NUEVO     ;CASTROPOL;6;97;26;470000000;4845361;-75,56714671;6,21981325;2021;6;17
175014;17-06-2021;VENTA           ;APARTAMENTO         ;NUEVO     ;CASTROPOL;6;106;27;560000000;5283019;-75,56714671;6,21981325;2021;6;17
175019;17-06-2021;VENTA           ;APARTAMENTO         ;NUEVO     ;CASTROPOL;6;104;0;570000000;5480769;-75,56714671;6,21981325;2021;6;17
175027;17-06-2021;VENTA           ;APARTAMENTO         ;NUEVO     ;CASTROPOL;6;128;52;765000000;5976563;-75,56506693;6,21630167;2021;6;17
175028;17-06-2021;VENTA           ;APARTAMENTO         ;NUEVO     ;CASTROPOL;6;115;52;740000000;6434783;-75,56506693;6,21630167;2021;6;17
175029;17-06-2021;VENTA           ;APARTAMENTO         ;NUEVO     ;CASTROPOL;6;120;52;735000000;6125000;-75,56506693;6,21630167;2021;6;17
175030;17-06-2021;VENTA           ;APARTAMENTO         ;NUEVO     ;CASTROPOL;6;124;52;740000000;5967742;-75,56506693;6,21630167;2021;6;17
175031;17-06-2021;VENTA           ;APARTAMENTO         ;NUEVO     ;CASTROPOL;6;125;54;748000000;5984000;-75,56506693;6,21630167;2021;6;17
175034;17-06-2021;VENTA           ;APARTAMENTO         ;NUEVO     ;ALTOS DEL POBLADO;6;86;0;490000000;5697674;-75,55663744;6,21639557;2021;6;17
175035;17-06-2021;VENTA           ;APARTAMENTO         ;NUEVO     ;ALTOS DEL POBLADO;6;86;0;530000000;6162791;-75,55663744;6,21639557;2021;6;17
175045;17-06-2021;VENTA           ;APARTAMENTO         ;NUEVO     ;EL TESORO;6;109;0;720000000;6605505;-75,55099386;6,20498098;2021;6;17
175073;17-06-2021;VENTA           ;APARTAMENTO         ;NUEVO     ;ALTOS DEL POBLADO;6;259;0;1842583000;7114220;-75,5478588;6,21237529;2021;6;17
175074;17-06-2021;VENTA           ;APARTAMENTO         ;NUEVO     ;ALTOS DEL POBLADO;6;298;0;2113000000;7090604;-75,5478588;6,21237529;2021;6;17
175107;17-06-2021;VENTA           ;APARTAMENTO         ;NUEVO     ;LAS LOMAS # 2;6;127;0;830000000;6535433;-75,55816479;6,21188033;2021;6;17
175419;17-06-2021;VENTA           ;APARTAMENTO         ;NUEVO     ;VILLA CARLOTA;6;71;0;514000000;7239437;-75,57357968;6,22441685;2021;6;17
175425;17-06-2021;VENTA           ;APARTAMENTO         ;NUEVO     ;LOS BALSOS # 1;6;310;0;1700000000;5483871;-75,55988586;6,18288043;2021;6;17
175439;17-06-2021;VENTA           ;APARTAMENTO         ;NUEVO     ;LOS BALSOS # 1;6;312;0;2500000000;8012821;-75,5591165;6,18395473;2021;6;17
175441;17-06-2021;VENTA           ;APARTAMENTO         ;NUEVO     ;ALTOS DEL POBLADO;6;86;0;470000000;5465116;-75,55663744;6,21639557;2021;6;17
175457;17-06-2021;VENTA           ;APARTAMENTO         ;NUEVO     ;LOS BALSOS # 1;6;312;0;2500000000;8012821;-75,5591165;6,18395473;2021;6;17
175468;17-06-2021;VENTA           ;APARTAMENTO         ;NUEVO     ;EL TESORO;6;85;0;530000000;6235294;-75,55465297;6,2062053;2021;6;17
175470;17-06-2021;VENTA           ;APARTAMENTO         ;NUEVO     ;ALEJANDRIA;6;127;0;750000000;5905512;-75,56798662;6,1993192;2021;6;17
175477;17-06-2021;VENTA           ;APARTAMENTO         ;NUEVO     ;LOS CONQUISTADORES;5;145;0;600000000;4137931;-75,58517755;6,23971535;2021;6;17
175613;09-06-2021;VENTA           ;APARTAMENTO         ;NUEVO     ;ZONA EXPANSION SAN ANTONIO;4;44;73326;131671000;2992523;-75,65448249;6,17459612;2021;6;9
175614;09-06-2021;VENTA           ;APARTAMENTO         ;NUEVO     ;ZONA EXPANSION PAJARITO;3;42;0;111000000;2642857;-75,6095693;6,28347192;2021;6;9
175615;09-06-2021;VENTA           ;APARTAMENTO         ;NUEVO     ;ZONA EXPANSION SAN ANTONIO;4;46;11745;128856000;2801217;-75,65542862;6,17593455;2021;6;9
175618;09-06-2021;VENTA           ;APARTAMENTO         ;NUEVO     ;ZONA EXPANSION PAJARITO;3;52;14;146600000;2819231;-75,60971395;6,28561574;2021;6;9
175621;09-06-2021;VENTA           ;APARTAMENTO         ;NUEVO     ;ZONA EXPANSION ALTOS DE CALASANZ;4;57;18864;256000000;4491228;-75,61077687;6,26727051;2021;6;9
175622;09-06-2021;VENTA           ;APARTAMENTO         ;NUEVO     ;ZONA EXPANSION ALTOS DE CALASANZ;4;62;18864;297000000;4790323;-75,61077687;6,26727051;2021;6;9
175623;09-06-2021;VENTA           ;APARTAMENTO         ;NUEVO     ;ZONA EXPANSION ALTOS DE CALASANZ;4;68;0;315000000;4632353;-75,61077687;6,26727051;2021;6;9
175626;09-06-2021;VENTA           ;APARTAMENTO         ;NUEVO     ;ZONA EXPANSION ALTOS DE CALASANZ;5;68;0;316300000;4651471;-75,60618245;6,27031148;2021;6;9
175627;09-06-2021;VENTA           ;APARTAMENTO         ;NUEVO     ;SANTA FE;5;66;22334;417400000;6324242;-75,57791821;6,2224836;2021;6;9
175628;09-06-2021;VENTA           ;APARTAMENTO         ;NUEVO     ;SANTA FE;5;68;22334;417400000;6138235;-75,57791821;6,2224836;2021;6;9
175629;09-06-2021;VENTA           ;APARTAMENTO         ;NUEVO     ;SANTA FE;5;68;22334;421400000;6197059;-75,57791821;6,2224836;2021;6;9
175630;09-06-2021;VENTA           ;APARTAMENTO         ;NUEVO     ;SANTA FE;5;72;0;470300000;6531944;-75,57791821;6,2224836;2021;6;9
175631;09-06-2021;VENTA           ;APARTAMENTO         ;NUEVO     ;SANTA FE;5;66;22334;417000000;6318182;-75,57791821;6,2224836;2021;6;9
175632;09-06-2021;VENTA           ;APARTAMENTO         ;NUEVO     ;SANTA FE;5;79;0;472600000;5982278;-75,57791821;6,2224836;2021;6;9
175633;09-06-2021;VENTA           ;APARTAMENTO         ;NUEVO     ;SANTA FE;5;83;22334;501100000;6037349;-75,57791821;6,2224836;2021;6;9
175634;09-06-2021;VENTA           ;APARTAMENTO         ;NUEVO     ;SANTA FE;5;83;0;501100000;6037349;-75,57791821;6,2224836;2021;6;9
175635;09-06-2021;VENTA           ;APARTAMENTO         ;NUEVO     ;SANTA FE;5;82;22334;490300000;5979268;-75,57791821;6,2224836;2021;6;9
175636;09-06-2021;VENTA           ;APARTAMENTO         ;NUEVO     ;VILLA CARLOTA;6;56;5537;399300000;7130357;-75,57367253;6,22143131;2021;6;9
175637;09-06-2021;VENTA           ;APARTAMENTO         ;NUEVO     ;VILLA CARLOTA;6;55;5537;612400000;11134545;-75,57367253;6,22143131;2021;6;9
175638;09-06-2021;VENTA           ;APARTAMENTO         ;NUEVO     ;LOS BALSOS # 2;5;108;58;755050000;6991204;-75,57058318;6,19469456;2021;6;9
175639;09-06-2021;VENTA           ;APARTAMENTO         ;NUEVO     ;LOS BALSOS # 2;5;114;61;902020671;7912462;-75,57058318;6,19469456;2021;6;9
175640;09-06-2021;VENTA           ;APARTAMENTO         ;NUEVO     ;LOS BALSOS # 2;5;124;61;816600000;6585484;-75,57058318;6,19469456;2021;6;9
175641;09-06-2021;VENTA           ;APARTAMENTO         ;NUEVO     ;ALTAMIRA;4;62;2749;332000000;5354839;-75,58259418;6,27868178;2021;6;9
175647;09-06-2021;VENTA           ;APARTAMENTO         ;NUEVO     ;ASOMADERA # 1;6;59;0;376000000;6372881;-75,56366646;6,22856076;2021;6;9
175648;09-06-2021;VENTA           ;APARTAMENTO         ;NUEVO     ;ASOMADERA # 1;6;86;4070;376000000;4372093;-75,56366646;6,22856076;2021;6;9
175649;09-06-2021;VENTA           ;APARTAMENTO         ;NUEVO     ;ASOMADERA # 1;6;101;4070;647000000;6405941;-75,56366646;6,22856076;2021;6;9
175650;09-06-2021;VENTA           ;APARTAMENTO         ;NUEVO     ;LORENA;5;82;544;543496600;6628007;-75,59882884;6,24815394;2021;6;9
175651;09-06-2021;VENTA           ;APARTAMENTO         ;NUEVO     ;LORENA;5;105;0;677921000;6456390;-75,59882884;6,24815394;2021;6;9
175652;09-06-2021;VENTA           ;APARTAMENTO         ;NUEVO     ;LORENA;5;79;544;541918700;6859730;-75,59882884;6,24815394;2021;6;9
175653;09-06-2021;VENTA           ;APARTAMENTO         ;NUEVO     ;LORENA;5;90;544;749269900;8325221;-75,59882884;6,24815394;2021;6;9
175654;09-06-2021;VENTA           ;APARTAMENTO         ;NUEVO     ;LOS BALSOS # 1;6;49;15662;390494550;7969277;-75,56281821;6,19078226;2021;6;9
175657;09-06-2021;VENTA           ;APARTAMENTO         ;NUEVO     ;LOS BALSOS # 1;6;60;15662;480000000;8000000;-75,56281821;6,19078226;2021;6;9
175658;09-06-2021;VENTA           ;APARTAMENTO         ;NUEVO     ;LOS BALSOS # 1;6;61;15662;434603200;7124643;-75,56281821;6,19078226;2021;6;9
175659;09-06-2021;VENTA           ;APARTAMENTO         ;NUEVO     ;SAN JOAQUIN;5;75;646;447813353;5970845;-75,58421363;6,24699213;2021;6;9
175660;09-06-2021;VENTA           ;APARTAMENTO         ;NUEVO     ;SAN JOAQUIN;5;82;0;478084073;5830294;-75,58421363;6,24699213;2021;6;9
175661;09-06-2021;VENTA           ;APARTAMENTO         ;NUEVO     ;SAN JOAQUIN;5;82;646;489178373;5965590;-75,58421363;6,24699213;2021;6;9
175662;09-06-2021;VENTA           ;APARTAMENTO         ;NUEVO     ;SAN JOAQUIN;5;83;646;489178373;5893715;-75,58421363;6,24699213;2021;6;9
175663;09-06-2021;VENTA           ;APARTAMENTO         ;NUEVO     ;SAN JOAQUIN;5;86;646;489178373;5688121;-75,58421363;6,24699213;2021;6;9
175664;09-06-2021;VENTA           ;APARTAMENTO         ;NUEVO     ;SAN JOAQUIN;5;107;646;604597515;5650444;-75,58421363;6,24699213;2021;6;9
175668;10-06-2021;VENTA           ;APARTAMENTO         ;NUEVO     ;CUARTA BRIGADA;4;95;27;479112844;5043293;-75,58645026;6,26239917;2021;6;10
175669;10-06-2021;VENTA           ;APARTAMENTO         ;NUEVO     ;CUARTA BRIGADA;4;106;27;528862501;4989269;-75,58645026;6,26239917;2021;6;10
175670;10-06-2021;VENTA           ;APARTAMENTO         ;NUEVO     ;CUARTA BRIGADA;4;106;27;529943400;4999466;-75,58645026;6,26239917;2021;6;10
175671;10-06-2021;VENTA           ;APARTAMENTO         ;NUEVO     ;CUARTA BRIGADA;4;89;25;460316144;5172092;-75,58645026;6,26239917;2021;6;10
175672;10-06-2021;VENTA           ;APARTAMENTO         ;NUEVO     ;LOS BALSOS # 1;6;88;3291;721000000;8193182;-75,55980957;6,19154733;2021;6;10
175675;10-06-2021;VENTA           ;APARTAMENTO         ;NUEVO     ;LOS BALSOS # 1;6;109;3291;867250000;7956422;-75,55980957;6,19154733;2021;6;10
175676;10-06-2021;VENTA           ;APARTAMENTO         ;NUEVO     ;LOS BALSOS # 1;6;156;3291;1220000000;7820513;-75,55980957;6,19154733;2021;6;10
175677;10-06-2021;VENTA           ;APARTAMENTO         ;NUEVO     ;LOS BALSOS # 1;6;139;3291;1090000000;7841727;-75,55980957;6,19154733;2021;6;10
175691;10-06-2021;VENTA           ;APARTAMENTO         ;NUEVO     ;LOS BALSOS # 1;6;68;15662;487868352;7174535;-75,56281821;6,19078226;2021;6;10
175692;10-06-2021;VENTA           ;APARTAMENTO         ;NUEVO     ;LOS BALSOS # 1;6;87;15662;626845586;7205122;-75,56281821;6,19078226;2021;6;10
175696;10-06-2021;VENTA           ;APARTAMENTO         ;NUEVO     ;VILLA CARLOTA;6;49;3708;419000000;8551020;-75,57399394;6,22516647;2021;6;10
175698;10-06-2021;VENTA           ;APARTAMENTO         ;NUEVO     ;VILLA CARLOTA;6;49;3708;407000000;8306122;-75,57399394;6,22516647;2021;6;10
175699;10-06-2021;VENTA           ;APARTAMENTO         ;NUEVO     ;VILLA CARLOTA;6;81;3708;600000000;7407407;-75,57399394;6,22516647;2021;6;10
175701;10-06-2021;VENTA           ;APARTAMENTO         ;NUEVO     ;ALTOS DEL POBLADO;6;69;0;600000000;8695652;-75,55541675;6,21760538;2021;6;10
175705;10-06-2021;VENTA           ;APARTAMENTO         ;NUEVO     ;ALTOS DEL POBLADO;6;79;0;550000000;6962025;-75,55541675;6,21760538;2021;6;10
175706;10-06-2021;VENTA           ;APARTAMENTO         ;NUEVO     ;ALTOS DEL POBLADO;6;75;1338;600000000;8000000;-75,55541675;6,21760538;2021;6;10
175709;10-06-2021;VENTA           ;APARTAMENTO         ;NUEVO     ;ALTOS DEL POBLADO;6;91;1338;715000000;7857143;-75,55541675;6,21760538;2021;6;10
175710;10-06-2021;VENTA           ;APARTAMENTO         ;NUEVO     ;ALTOS DEL POBLADO;6;96;1338;791400000;8243750;-75,55541675;6,21760538;2021;6;10
175718;10-06-2021;VENTA           ;APARTAMENTO         ;NUEVO     ;ALTOS DEL POBLADO;6;92;1338;774600000;8419565;-75,55541675;6,21760538;2021;6;10
175720;10-06-2021;VENTA           ;APARTAMENTO         ;NUEVO     ;ALTOS DEL POBLADO;6;96;1338;790000000;8229167;-75,55541675;6,21760538;2021;6;10
175721;10-06-2021;VENTA           ;APARTAMENTO         ;NUEVO     ;ALTOS DEL POBLADO;6;112;1338;899500000;8031250;-75,55541675;6,21760538;2021;6;10
175727;10-06-2021;VENTA           ;APARTAMENTO         ;NUEVO     ;CASTROPOL;6;87;2690;895000000;10287356;-75,56671798;6,21457601;2021;6;10
175730;10-06-2021;VENTA           ;APARTAMENTO         ;NUEVO     ;LAS LOMAS # 2;6;83;637;735000000;8855422;-75,55970134;6,21452176;2021;6;10
175731;10-06-2021;VENTA           ;APARTAMENTO         ;NUEVO     ;LAS LOMAS # 2;6;102;637;866000000;8490196;-75,55970134;6,21452176;2021;6;10
175732;10-06-2021;VENTA           ;APARTAMENTO         ;NUEVO     ;LAS LOMAS # 2;6;86;637;810000000;9418605;-75,55970134;6,21452176;2021;6;10
175733;10-06-2021;VENTA           ;APARTAMENTO         ;NUEVO     ;LAURELES;6;120;23;744000000;6200000;-75,59237787;6,24077539;2021;6;10
175823;17-06-2021;VENTA           ;APARTAMENTO         ;NUEVO     ;LOS BALSOS # 2;6;97;0;847000000;8731959;-75,57202295;6,19592198;2021;6;17
175824;17-06-2021;VENTA           ;APARTAMENTO         ;NUEVO     ;ALTOS DEL POBLADO;6;158;0;1285000000;8132911;-75,54973895;6,21061381;2021;6;17
175825;17-06-2021;VENTA           ;APARTAMENTO         ;NUEVO     ;EL TESORO;6;182;0;1400000000;7692308;-75,55780383;6,20179842;2021;6;17
175826;17-06-2021;VENTA           ;APARTAMENTO         ;NUEVO     ;ALEJANDRIA;6;90;0;862000000;9577778;-75,57008846;6,20237932;2021;6;17
175827;17-06-2021;VENTA           ;APARTAMENTO         ;NUEVO     ;PATIO BONITO;6;50;0;534000000;10680000;-75,57364363;6,20747665;2021;6;17
175828;17-06-2021;VENTA           ;APARTAMENTO         ;NUEVO     ;LALINDE;6;87;0;753000000;8655172;-75,56880815;6,21275978;2021;6;17
175830;17-06-2021;VENTA           ;APARTAMENTO         ;NUEVO     ;CASTROPOL;6;67;0;511000000;7626866;-75,56897198;6,22134469;2021;6;17
175832;17-06-2021;VENTA           ;APARTAMENTO         ;NUEVO     ;ALTOS DEL POBLADO;6;44;0;438000000;9954545;-75,55631161;6,21728948;2021;6;17
175833;17-06-2021;VENTA           ;APARTAMENTO         ;NUEVO     ;LOS BALSOS # 1;6;62;0;478000000;7709677;-75,56281821;6,19078226;2021;6;17
175834;17-06-2021;VENTA           ;APARTAMENTO         ;NUEVO     ;LOS BALSOS # 1;6;80;0;565000000;7062500;-75,56366042;6,19104654;2021;6;17
175835;17-06-2021;VENTA           ;APARTAMENTO         ;NUEVO     ;LOS BALSOS # 1;6;61;0;450000000;7377049;-75,56281821;6,19078226;2021;6;17
175836;17-06-2021;VENTA           ;APARTAMENTO         ;NUEVO     ;EL CASTILLO;6;168;0;1430000000;8511905;-75,57271526;6,19043159;2021;6;17
175837;17-06-2021;VENTA           ;APARTAMENTO         ;NUEVO     ;VILLA CARLOTA;6;38;0;319830000;8416579;-75,57218838;6,2242802;2021;6;17
175838;17-06-2021;VENTA           ;APARTAMENTO         ;NUEVO     ;SAN DIEGO;6;66;0;505400000;7657576;-75,56545052;6,22664575;2021;6;17
175840;17-06-2021;VENTA           ;APARTAMENTO         ;NUEVO     ;LAS LOMAS # 2;6;76;0;713980000;9394474;-75,5600979;6,21466001;2021;6;17
175841;17-06-2021;VENTA           ;APARTAMENTO         ;NUEVO     ;ALTOS DEL POBLADO;6;98;0;731710000;7466429;-75,55631161;6,21728948;2021;6;17
175842;17-06-2021;VENTA           ;APARTAMENTO         ;NUEVO     ;ALTOS DEL POBLADO;6;94;0;671830000;7147128;-75,55582666;6,21662494;2021;6;17
175852;21-06-2021;VENTA           ;APARTAMENTO         ;NUEVO     ;ZONA DE EXPANSION BELEN RINCON;5;58;22;290000000;5000000;-75,60730917;6,21163819;2021;6;21
175854;21-06-2021;VENTA           ;APARTAMENTO         ;NUEVO     ;ZONA DE EXPANSION BELEN RINCON;5;102;44;535000000;5245098;-75,60699788;6,21581188;2021;6;21
175855;21-06-2021;VENTA           ;APARTAMENTO         ;NUEVO     ;ZONA DE EXPANSION BELEN RINCON;5;60;36;190000000;3166667;-75,60699788;6,21581188;2021;6;21
175895;23-06-2021;VENTA           ;APARTAMENTO         ;NUEVO     ;ZONA EXPANSION PAJARITO;3;52;18;165000000;3173077;-75,60927162;6,28522799;2021;6;23
175896;23-06-2021;VENTA           ;APARTAMENTO         ;NUEVO     ;ZONA EXPANSION PAJARITO;3;52;17;167000000;3211538;-75,60927162;6,28522799;2021;6;23
175897;23-06-2021;VENTA           ;APARTAMENTO         ;NUEVO     ;ZONA EXPANSION PAJARITO;3;52;18;180000000;3461538;-75,60927162;6,28522799;2021;6;23
175903;23-06-2021;VENTA           ;APARTAMENTO         ;NUEVO     ;OLAYA HERRERA;1;42;33;65000000;1547619;-75,6084808;6,27456196;2021;6;23
175913;24-06-2021;VENTA           ;APARTAMENTO         ;NUEVO     ;PAJARITO;3;41;26;170000000;4146341;-75,60752519;6,28302924;2021;6;24
176015;30-06-2021;VENTA           ;APARTAMENTO         ;NUEVO     ;NARANJAL;5;83;4;420000000;5060241;-75,58268319;6,25056864;2021;6;30
176115;07-07-2021;VENTA           ;APARTAMENTO         ;NUEVO     ;LOS NARANJOS;4;205;2;975818508;4760090;-75,55729328;6,1948052;2021;7;7
176127;07-07-2021;VENTA           ;APARTAMENTO         ;NUEVO     ;PAJARITO;3;65;31;140000000;2153846;-75,60740697;6,28267559;2021;7;7
176218;12-07-2021;VENTA           ;APARTAMENTO         ;NUEVO     ;LOS ALCAZARES;3;58;205;190000000;3275862;-75,60458911;6,26228441;2021;7;12
176227;12-07-2021;VENTA           ;APARTAMENTO         ;NUEVO     ;LOS ALCAZARES;4;34;4;130000000;3823529;-75,60441468;6,26230156;2021;7;12
176371;15-07-2021;VENTA           ;APARTAMENTO         ;NUEVO     ;CALASANZ;5;110;26;450000000;4090909;-75,59800195;6,26244166;2021;7;15
176373;15-07-2021;VENTA           ;APARTAMENTO         ;NUEVO     ;CALASANZ;6;87;22;480000000;5517241;-75,59958838;6,26076218;2021;7;15
176383;15-07-2021;VENTA           ;APARTAMENTO         ;NUEVO     ;FERRINI;4;24;31;110000000;4583333;-75,59583651;6,27007489;2021;7;15
176384;15-07-2021;VENTA           ;APARTAMENTO         ;NUEVO     ;SIMON BOLIVAR;5;112;244;548000000;4892857;-75,60586696;6,24691215;2021;7;15
176385;15-07-2021;VENTA           ;APARTAMENTO         ;NUEVO     ;SIMON BOLIVAR;5;155;244;576000000;3716129;-75,60586696;6,24691215;2021;7;15
176386;15-07-2021;VENTA           ;APARTAMENTO         ;NUEVO     ;SIMON BOLIVAR;5;252;0;523000000;2075397;-75,60586696;6,24691215;2021;7;15
176387;15-07-2021;VENTA           ;APARTAMENTO         ;NUEVO     ;SIMON BOLIVAR;5;106;0;520000000;4905660;-75,60586696;6,24691215;2021;7;15
176397;16-07-2021;VENTA           ;APARTAMENTO         ;NUEVO     ;SIMON BOLIVAR;5;96;0;450000000;4687500;-75,60721083;6,246579;2021;7;16
176398;16-07-2021;VENTA           ;APARTAMENTO         ;NUEVO     ;SIMON BOLIVAR;5;64;0;285000000;4453125;-75,60690238;6,24675407;2021;7;16
176599;21-07-2021;VENTA           ;APARTAMENTO         ;NUEVO     ;SAN JAVIER # 1;3;41;8;160000000;3902439;-75,61437118;6,25597924;2021;7;21
176608;21-07-2021;VENTA           ;APARTAMENTO         ;NUEVO     ;SAN JAVIER # 1;3;110;39;260000000;2363636;-75,6186998;6,25670245;2021;7;21
176618;21-07-2021;VENTA           ;APARTAMENTO         ;NUEVO     ;SANTA MONICA;4;75;36;250000000;3333333;-75,61353323;6,24992521;2021;7;21
176705;22-07-2021;VENTA           ;APARTAMENTO         ;NUEVO     ;GERONA;3;84;26;210000000;2500000;-75,55673681;6,23814919;2021;7;22
176912;27-07-2021;VENTA           ;APARTAMENTO         ;NUEVO     ;BARRIO DE JESUS;3;40;22;118000000;2950000;-75,53768255;6,22787872;2021;7;27
176941;27-07-2021;VENTA           ;APARTAMENTO         ;NUEVO     ;EL SOCORRO;1;45;7;95000000;2111111;-75,61923496;6,2626592;2021;7;27
176962;30-07-2021;VENTA           ;APARTAMENTO         ;NUEVO     ;BARRIO CAICEDO;3;78;182;280000000;3589744;-75,55630661;6,24287098;2021;7;30
176964;30-07-2021;VENTA           ;APARTAMENTO         ;NUEVO     ;BARRIO CAICEDO;3;58;0;210000000;3620690;-75,55630661;6,24287098;2021;7;30
177043;02-08-2021;VENTA           ;APARTAMENTO         ;NUEVO     ;LA PRADERA;3;82;27;130000000;1585366;-75,60924816;6,26062628;2021;8;2
177190;04-08-2021;VENTA           ;APARTAMENTO         ;NUEVO     ;SAN MIGUEL;3;53;22;190000000;3584906;-75,55947882;6,25723805;2021;8;4
177241;05-08-2021;VENTA           ;APARTAMENTO         ;NUEVO     ;LA MANSION;3;46;10;190000000;4130435;-75,55432358;6,25819135;2021;8;5
177258;06-08-2021;VENTA           ;APARTAMENTO         ;NUEVO     ;MANRIQUE CENTRAL # 1;3;180;76;380000000;2111111;-75,55910575;6,26562707;2021;8;6
177322;09-08-2021;VENTA           ;APARTAMENTO         ;NUEVO     ;VILLA HERMOSA;4;68;19;225000000;3308824;-75,55181833;6,25767033;2021;8;9
177326;09-08-2021;VENTA           ;APARTAMENTO         ;NUEVO     ;SAN MIGUEL;3;70;69;240000000;3428571;-75,55791912;6,25610438;2021;8;9
177454;11-08-2021;VENTA           ;APARTAMENTO         ;NUEVO     ;SUCRE;3;73;25;225000000;3082192;-75,55383145;6,24558449;2021;8;11
177455;12-08-2021;VENTA           ;APARTAMENTO         ;NUEVO     ;SUCRE;3;77;24;225000000;2922078;-75,55383145;6,24558449;2021;8;12
177463;12-08-2021;VENTA           ;APARTAMENTO         ;NUEVO     ;CASTROPOL;6;84;0;875542633;10423127;-75,56681599;6,21425743;2021;8;12
177487;12-08-2021;VENTA           ;APARTAMENTO         ;NUEVO     ;ZONA EXPANSION ALTOS DE CALASANZ;5;68;2021;324000000;4764706;-75,60663098;6,2694401;2021;8;12
177522;12-08-2021;VENTA           ;APARTAMENTO         ;NUEVO     ;SAN MIGUEL;3;76;29;255000000;3355263;-75,55510355;6,25619655;2021;8;12
177538;12-08-2021;VENTA           ;APARTAMENTO         ;NUEVO     ;BOSTON;3;80;377;250000000;3125000;-75,55423969;6,2490437;2021;8;12
177550;13-08-2021;VENTA           ;APARTAMENTO         ;NUEVO     ;SUCRE;3;95;126;220000000;2315789;-75,55111602;6,24289099;2021;8;13
177607;17-08-2021;VENTA           ;APARTAMENTO         ;NUEVO     ;CASTILLA;3;80;26;170000000;2125000;-75,56991625;6,29189752;2021;8;17
177630;17-08-2021;VENTA           ;APARTAMENTO         ;NUEVO     ;EL NOGAL - LOS ALMENDROS;5;108;35;689000000;6379630;-75,59558614;6,23777437;2021;8;17
177677;17-08-2021;VENTA           ;APARTAMENTO         ;NUEVO     ;VILLA CARLOTA;6;107;8772;770000000;7196262;-75,57218838;6,2242802;2021;8;17
177688;17-08-2021;VENTA           ;APARTAMENTO         ;NUEVO     ;EL CASTILLO;5;107;2343;943800000;8820561;-75,57157465;6,19249763;2021;8;17
177690;17-08-2021;VENTA           ;APARTAMENTO         ;NUEVO     ;ALTOS DEL POBLADO;5;122;2771;850000000;6967213;-75,55508489;6,21723878;2021;8;17
177735;18-08-2021;VENTA           ;APARTAMENTO         ;NUEVO     ;SAN MIGUEL;2;84;43;260000000;3095238;-75,55337355;6,25415902;2021;8;18
177795;19-08-2021;VENTA           ;APARTAMENTO         ;NUEVO     ;LA LIBERTAD;1;57;0;75000000;1315789;-75,54171382;6,2407002;2021;8;19
177807;19-08-2021;VENTA           ;APARTAMENTO         ;NUEVO     ;VILLATINA;2;108;57;150000000;1388889;-75,54058126;6,23743561;2021;8;19
177869;26-08-2021;VENTA           ;APARTAMENTO         ;NUEVO     ;SAN BERNARDO;3;290;12;479000000;1651724;-75,59656365;6,22430247;2021;8;26
177902;26-08-2021;VENTA           ;APARTAMENTO         ;NUEVO     ;ROSALES;5;101;32;300000000;2970297;-75,59171952;6,23275065;2021;8;26
177941;27-08-2021;VENTA           ;APARTAMENTO         ;NUEVO     ;LOS CONQUISTADORES;5;110;216;420000000;3818182;-75,58057864;6,24476215;2021;8;27
177942;27-08-2021;VENTA           ;APARTAMENTO         ;NUEVO     ;LOS CONQUISTADORES;5;110;216;430000000;3909091;-75,58057864;6,24476215;2021;8;27
177947;27-08-2021;VENTA           ;APARTAMENTO         ;NUEVO     ;LOS CONQUISTADORES;6;104;21;540000000;5192308;-75,58624273;6,24146912;2021;8;27
178078;02-09-2021;VENTA           ;APARTAMENTO         ;NUEVO     ;MANRIQUE CENTRAL # 2;3;71;37;200000000;2816901;-75,55319297;6,26365286;2021;9;2
178093;02-09-2021;VENTA           ;APARTAMENTO         ;NUEVO     ;MANRIQUE CENTRAL # 2;4;126;45;360000000;2857143;-75,55438652;6,26528422;2021;9;2
178106;02-09-2021;VENTA           ;APARTAMENTO         ;NUEVO     ;MANRIQUE CENTRAL # 2;3;95;0;231000000;2431579;-75,5522618;6,26562932;2021;9;2
178110;02-09-2021;VENTA           ;APARTAMENTO         ;NUEVO     ;MANRIQUE CENTRAL # 2;3;93;0;211000000;2268817;-75,5522618;6,26562932;2021;9;2
178112;02-09-2021;VENTA           ;APARTAMENTO         ;NUEVO     ;MANRIQUE CENTRAL # 2;3;93;0;214000000;2301075;-75,5522618;6,26562932;2021;9;2
178119;02-09-2021;VENTA           ;APARTAMENTO         ;NUEVO     ;MANRIQUE CENTRAL # 2;3;93;52;115000000;1236559;-75,55378249;6,2658866;2021;9;2
178120;02-09-2021;VENTA           ;APARTAMENTO         ;NUEVO     ;MANRIQUE CENTRAL # 2;3;93;0;232000000;2494624;-75,5522618;6,26562932;2021;9;2
178130;03-09-2021;VENTA           ;APARTAMENTO         ;NUEVO     ;ROSALES;4;143;61;350000000;2447552;-75,59194334;6,23306827;2021;9;3
178131;03-09-2021;VENTA           ;APARTAMENTO         ;NUEVO     ;ROSALES;4;77;65;270000000;3506494;-75,59194334;6,23306827;2021;9;3
178178;07-09-2021;VENTA           ;APARTAMENTO         ;NUEVO     ;CAMPO VALDES # 2;3;61;141;120000000;1967213;-75,55274218;6,27566107;2021;9;7
178229;08-09-2021;VENTA           ;APARTAMENTO         ;NUEVO     ;CAMPO VALDES # 2;2;67;0;140000000;2089552;-75,55130569;6,26993378;2021;9;8
178230;08-09-2021;VENTA           ;APARTAMENTO         ;NUEVO     ;MANRIQUE CENTRAL # 2;3;82;445;219000000;2670732;-75,5522618;6,26562932;2021;9;8
178236;08-09-2021;VENTA           ;APARTAMENTO         ;NUEVO     ;MANRIQUE CENTRAL # 2;3;75;445;199340000;2657867;-75,5522618;6,26562932;2021;9;8
178240;08-09-2021;VENTA           ;APARTAMENTO         ;NUEVO     ;MANRIQUE CENTRAL # 2;3;84;445;225730000;2687262;-75,5522618;6,26562932;2021;9;8
178243;08-09-2021;VENTA           ;APARTAMENTO         ;NUEVO     ;CAMPO VALDES # 2;2;67;0;145000000;2164179;-75,55130569;6,26993378;2021;9;8
178244;08-09-2021;VENTA           ;APARTAMENTO         ;NUEVO     ;MANRIQUE CENTRAL # 2;3;82;445;218000000;2658537;-75,5522618;6,26562932;2021;9;8
178246;08-09-2021;VENTA           ;APARTAMENTO         ;NUEVO     ;MANRIQUE CENTRAL # 2;3;73;445;190000000;2602740;-75,5522618;6,26562932;2021;9;8
178249;08-09-2021;VENTA           ;APARTAMENTO         ;NUEVO     ;EL POMAR;3;83;30;200000000;2409639;-75,55214538;6,26854896;2021;9;8
178251;08-09-2021;VENTA           ;APARTAMENTO         ;NUEVO     ;MANRIQUE CENTRAL # 2;3;75;445;195000000;2600000;-75,5522618;6,26562932;2021;9;8
178253;08-09-2021;VENTA           ;APARTAMENTO         ;NUEVO     ;MANRIQUE CENTRAL # 2;3;84;445;220730000;2627738;-75,5522618;6,26562932;2021;9;8
178257;08-09-2021;VENTA           ;APARTAMENTO         ;NUEVO     ;VERSALLES # 1;2;64;22;130000000;2031250;-75,54569814;6,26624115;2021;9;8
178365;14-09-2021;VENTA           ;APARTAMENTO         ;NUEVO     ;LAS ESMERALDAS;3;118;41;217000000;1838983;-75,55357957;6,27803666;2021;9;14
178393;15-09-2021;VENTA           ;APARTAMENTO         ;NUEVO     ;ZONA DE EXPANSION BELEN RINCON;4;61;24;287000000;4704918;-75,60701107;6,21240198;2021;9;15
178398;17-09-2021;VENTA           ;APARTAMENTO         ;NUEVO     ;LA FLORESTA;3;100;27;380000000;3800000;-75,60447233;6,25505124;2021;9;17
178404;20-09-2021;VENTA           ;APARTAMENTO         ;NUEVO     ;EL SALVADOR;3;70;161;185000000;2642857;-75,56205216;6,23750521;2021;9;20
178468;21-09-2021;VENTA           ;APARTAMENTO         ;NUEVO     ;ASOMADERA # 2;6;87;28;470000000;5402299;-75,56332449;6,21929397;2021;9;21
178498;22-09-2021;VENTA           ;APARTAMENTO         ;NUEVO     ;CAMPO VALDES # 2;3;61;152;120000000;1967213;-75,55239963;6,27561834;2021;9;22
178506;22-09-2021;VENTA           ;APARTAMENTO         ;NUEVO     ;GIRARDOT;3;87;32;230000000;2643678;-75,56792931;6,29564091;2021;9;22
178509;22-09-2021;VENTA           ;APARTAMENTO         ;NUEVO     ;EL DANUBIO;4;54;8;251000000;4648148;-75,609783;6,25339546;2021;9;22
178603;24-09-2021;VENTA           ;APARTAMENTO         ;NUEVO     ;CRISTO REY;4;77;288;233000000;3025974;-75,58655302;6,20633798;2021;9;24
178726;27-09-2021;VENTA           ;APARTAMENTO         ;NUEVO     ;BUENOS AIRES;3;59;175;265500000;4500000;-75,55981822;6,24228175;2021;9;27
178735;27-09-2021;VENTA           ;APARTAMENTO         ;NUEVO     ;BUENOS AIRES;3;57;175;256500000;4500000;-75,55981822;6,24228175;2021;9;27
179003;29-09-2021;VENTA           ;APARTAMENTO         ;NUEVO     ;MANRIQUE CENTRAL # 2;4;129;46;340000000;2635659;-75,55438652;6,26528422;2021;9;29
179040;01-10-2021;VENTA           ;APARTAMENTO         ;NUEVO     ;MANRIQUE CENTRAL # 1;3;165;89;250000000;1515152;-75,55675291;6,26679023;2021;10;1
179044;01-10-2021;VENTA           ;APARTAMENTO         ;NUEVO     ;MANRIQUE CENTRAL # 1;3;87;37;180000000;2068966;-75,5557916;6,26784299;2021;10;1
179068;04-10-2021;VENTA           ;APARTAMENTO         ;NUEVO     ;CAMPO VALDES # 1;3;44;14;138000000;3136364;-75,55763839;6,2699998;2021;10;4
179094;05-10-2021;VENTA           ;APARTAMENTO         ;NUEVO     ;SANTA TERESITA;5;100;27;275000000;2750000;-75,6135708;6,24372355;2021;10;5
179107;05-10-2021;VENTA           ;APARTAMENTO         ;NUEVO     ;EL DIAMANTE;2;160;70;240000000;1500000;-75,58888422;6,28706868;2021;10;5
179129;06-10-2021;VENTA           ;APARTAMENTO         ;NUEVO     ;LA FLORESTA;3;64;132;250000000;3906250;-75,60345937;6,25774364;2021;10;6
179133;06-10-2021;VENTA           ;APARTAMENTO         ;NUEVO     ;LA FLORESTA;3;64;132;260000000;4062500;-75,60345937;6,25774364;2021;10;6
179164;07-10-2021;VENTA           ;APARTAMENTO         ;NUEVO     ;ZONA DE EXPANSION BELEN RINCON;4;53;21;175000000;3301887;-75,60701107;6,21240198;2021;10;7
179165;07-10-2021;VENTA           ;APARTAMENTO         ;NUEVO     ;ZONA DE EXPANSION BELEN RINCON;4;51;21;185000000;3627451;-75,60701107;6,21240198;2021;10;7
179166;07-10-2021;VENTA           ;APARTAMENTO         ;NUEVO     ;ZONA DE EXPANSION BELEN RINCON;4;53;21;180000000;3396226;-75,60701107;6,21240198;2021;10;7
179174;07-10-2021;VENTA           ;APARTAMENTO         ;NUEVO     ;SAN ISIDRO;3;58;0;179000000;3086207;-75,55890443;6,286322;2021;10;7
179176;07-10-2021;VENTA           ;APARTAMENTO         ;NUEVO     ;SAN ISIDRO;3;60;0;187000000;3116667;-75,55890443;6,286322;2021;10;7
179177;07-10-2021;VENTA           ;APARTAMENTO         ;NUEVO     ;SAN ISIDRO;3;63;49;197000000;3126984;-75,55890443;6,286322;2021;10;7
179184;08-10-2021;VENTA           ;APARTAMENTO         ;NUEVO     ;SAN ISIDRO;3;67;49;210000000;3134328;-75,55890443;6,286322;2021;10;8
179186;08-10-2021;VENTA           ;APARTAMENTO         ;NUEVO     ;SAN ISIDRO;3;84;49;260000000;3095238;-75,55890443;6,286322;2021;10;8
179202;08-10-2021;VENTA           ;APARTAMENTO         ;NUEVO     ;SAN ISIDRO;3;120;0;290000000;2416667;-75,55955496;6,28443334;2021;10;8
179215;08-10-2021;VENTA           ;APARTAMENTO         ;NUEVO     ;SAN BERNARDO;3;176;22;300000000;1704545;-75,59646041;6,22712531;2021;10;8
179225;11-10-2021;VENTA           ;APARTAMENTO         ;NUEVO     ;EL DANUBIO;4;85;34;299000000;3517647;-75,6099304;6,253277;2021;10;11
179229;11-10-2021;VENTA           ;APARTAMENTO         ;NUEVO     ;SANTA MONICA;4;90;21;300000000;3333333;-75,61263292;6,24922385;2021;10;11
179233;11-10-2021;VENTA           ;APARTAMENTO         ;NUEVO     ;ARANJUEZ;3;89;27;270000000;3033708;-75,56027776;6,28317535;2021;10;11
179247;11-10-2021;VENTA           ;APARTAMENTO         ;NUEVO     ;CABECERA SAN ANTONIO DE PRADO;3;72;0;165000000;2291667;-75,65931915;6,18765058;2021;10;11
179261;12-10-2021;VENTA           ;APARTAMENTO         ;NUEVO     ;SAN LUCAS;6;49;0;484000000;9877551;-75,56289159;6,18354361;2021;10;12
179265;12-10-2021;VENTA           ;APARTAMENTO         ;NUEVO     ;LA PALMA;5;65;95;470000000;7230769;-75,60233827;6,22731357;2021;10;12
179276;12-10-2021;VENTA           ;APARTAMENTO         ;NUEVO     ;SAN MIGUEL;2;130;42;250000000;1923077;-75,55337355;6,25415902;2021;10;12
179306;13-10-2021;VENTA           ;APARTAMENTO         ;NUEVO     ;LORENA;5;72;0;452299000;6281931;-75,60106206;6,25025291;2021;10;13
179308;13-10-2021;VENTA           ;APARTAMENTO         ;NUEVO     ;CUARTA BRIGADA;5;75;1709;486000000;6480000;-75,58865441;6,26132849;2021;10;13
179309;13-10-2021;VENTA           ;APARTAMENTO         ;NUEVO     ;LA AGUACATALA;6;50;627;465000000;9300000;-75,57810485;6,1968171;2021;10;13
179329;14-10-2021;VENTA           ;APARTAMENTO         ;NUEVO     ;LA MILAGROSA;3;78;258;220000000;2820513;-75,55655226;6,23651079;2021;10;14
179330;14-10-2021;VENTA           ;APARTAMENTO         ;NUEVO     ;LA MILAGROSA;3;78;258;220000000;2820513;-75,55655226;6,23651079;2021;10;14
179331;14-10-2021;VENTA           ;APARTAMENTO         ;NUEVO     ;LA MILAGROSA;3;65;258;218000000;3353846;-75,55655226;6,23651079;2021;10;14
179356;15-10-2021;VENTA           ;APARTAMENTO         ;NUEVO     ;LA PALMA;6;75;95;546000000;7280000;-75,60233827;6,22731357;2021;10;15
179358;15-10-2021;VENTA           ;APARTAMENTO         ;NUEVO     ;LA AGUACATALA;6;71;627;619000000;8718310;-75,57810485;6,1968171;2021;10;15
179363;15-10-2021;VENTA           ;APARTAMENTO         ;NUEVO     ;ZONA EXPANSION ALTOS DE CALASANZ;5;79;3711;420000000;5316456;-75,608337;6,27007824;2021;10;15
179365;15-10-2021;VENTA           ;APARTAMENTO         ;NUEVO     ;MIRAFLORES;3;192;58;235000000;1223958;-75,5517761;6,23605325;2021;10;15
179366;15-10-2021;VENTA           ;APARTAMENTO         ;NUEVO     ;SAN LUCAS;6;76;12679;796400000;10478947;-75,56289159;6,18354361;2021;10;15
179471;22-10-2021;VENTA           ;APARTAMENTO         ;NUEVO     ;MIRANDA;2;42;2;130000000;3095238;-75,56216727;6,27634684;2021;10;22
179621;25-10-2021;VENTA           ;APARTAMENTO         ;NUEVO     ;SANTA TERESITA;5;100;193;420000000;4200000;-75,61228294;6,24273468;2021;10;25
179623;25-10-2021;VENTA           ;APARTAMENTO         ;NUEVO     ;SIMON BOLIVAR;5;42;4;170000000;4047619;-75,60690238;6,24675407;2021;10;25
179685;26-10-2021;VENTA           ;APARTAMENTO         ;NUEVO     ;LA FLORESTA;4;89;237;300000000;3370787;-75,60278785;6,25471394;2021;10;26
179710;27-10-2021;VENTA           ;APARTAMENTO         ;NUEVO     ;LA FLORESTA;4;55;2;220000000;4000000;-75,59934643;6,25703219;2021;10;27
179715;27-10-2021;VENTA           ;APARTAMENTO         ;NUEVO     ;CALASANZ PARTE ALTA;5;90;256;380000000;4222222;-75,60074066;6,26620567;2021;10;27
179719;27-10-2021;VENTA           ;APARTAMENTO         ;NUEVO     ;BARRIO DE JESUS;3;42;15;132000000;3142857;-75,53509508;6,22865123;2021;10;27
179728;27-10-2021;VENTA           ;APARTAMENTO         ;NUEVO     ;BARRIO DE JESUS;3;41;15;125000000;3048780;-75,53509508;6,22865123;2021;10;27
179735;27-10-2021;VENTA           ;APARTAMENTO         ;NUEVO     ;SIMON BOLIVAR;5;96;9;450000000;4687500;-75,60721083;6,246579;2021;10;27
179736;27-10-2021;VENTA           ;APARTAMENTO         ;NUEVO     ;LA FLORESTA;4;92;25;330000000;3586957;-75,6010406;6,25743428;2021;10;27
179744;28-10-2021;VENTA           ;APARTAMENTO         ;NUEVO     ;LA FLORESTA;3;100;217;380000000;3800000;-75,60429975;6,25481684;2021;10;28
179746;28-10-2021;VENTA           ;APARTAMENTO         ;NUEVO     ;SANTA LUCIA;3;76;43;230000000;3026316;-75,60844435;6,25753381;2021;10;28
179752;28-10-2021;VENTA           ;APARTAMENTO         ;NUEVO     ;SIMON BOLIVAR;5;64;20;285000000;4453125;-75,60690238;6,24675407;2021;10;28
179754;28-10-2021;VENTA           ;APARTAMENTO         ;NUEVO     ;EL DANUBIO;4;50;5;150000000;3000000;-75,609783;6,25339546;2021;10;28
179755;28-10-2021;VENTA           ;APARTAMENTO         ;NUEVO     ;BARRIO CRISTOBAL;3;117;230;380000000;3247863;-75,60882531;6,24801422;2021;10;28
179756;28-10-2021;VENTA           ;APARTAMENTO         ;NUEVO     ;EL DANUBIO;4;49;5;190000000;3877551;-75,609783;6,25339546;2021;10;28
179775;28-10-2021;VENTA           ;APARTAMENTO         ;NUEVO     ;SANTA MONICA;5;100;29;305000000;3050000;-75,61183633;6,24947906;2021;10;28
179777;28-10-2021;VENTA           ;APARTAMENTO         ;NUEVO     ;CALASANZ;6;85;22;480000000;5647059;-75,59958838;6,26076218;2021;10;28
179779;28-10-2021;VENTA           ;APARTAMENTO         ;NUEVO     ;SANTA TERESITA;4;100;147;315000000;3150000;-75,60855213;6,24224565;2021;10;28
179786;28-10-2021;VENTA           ;APARTAMENTO         ;NUEVO     ;LA AMERICA;4;80;31;320000000;4000000;-75,60358152;6,25231614;2021;10;28
179788;28-10-2021;VENTA           ;APARTAMENTO         ;NUEVO     ;LA AMERICA;4;80;31;340000000;4250000;-75,60358152;6,25231614;2021;10;28
179794;28-10-2021;VENTA           ;APARTAMENTO         ;NUEVO     ;CALASANZ PARTE ALTA;3;50;45;154500000;3090000;-75,60526825;6,26867702;2021;10;28
179804;28-10-2021;VENTA           ;APARTAMENTO         ;NUEVO     ;CALASANZ;6;120;24;500000000;4166667;-75,5988238;6,26045019;2021;10;28
179813;28-10-2021;VENTA           ;APARTAMENTO         ;NUEVO     ;CALASANZ;5;102;30;450000000;4411765;-75,59919766;6,26128944;2021;10;28
179827;29-10-2021;VENTA           ;APARTAMENTO         ;NUEVO     ;EL DANUBIO;4;53;10;230000000;4339623;-75,60786913;6,25398668;2021;10;29
179849;29-10-2021;VENTA           ;APARTAMENTO         ;NUEVO     ;LOS PINOS;5;128;51;410000000;3203125;-75,59714802;6,25242474;2021;10;29
179852;29-10-2021;VENTA           ;APARTAMENTO         ;NUEVO     ;FERRINI;5;85;252;440000000;5176471;-75,59648805;6,26822654;2021;10;29
179888;02-11-2021;VENTA           ;APARTAMENTO         ;NUEVO     ;CALASANZ;5;95;300;616700000;6491579;-75,59880934;6,26280918;2021;11;2
179899;02-11-2021;VENTA           ;APARTAMENTO         ;NUEVO     ;CALASANZ;5;115;360;600000000;5217391;-75,59826498;6,26179793;2021;11;2
179956;03-11-2021;VENTA           ;APARTAMENTO         ;NUEVO     ;SANTA MONICA;4;89;43;298000000;3348315;-75,61353323;6,24992521;2021;11;3
179967;04-11-2021;VENTA           ;APARTAMENTO         ;NUEVO     ;LA FLORESTA;4;72;281;327000000;4541667;-75,59979969;6,25617575;2021;11;4
179968;04-11-2021;VENTA           ;APARTAMENTO         ;NUEVO     ;LA FLORESTA;4;33;281;207000000;6272727;-75,59979969;6,25617575;2021;11;4
179971;04-11-2021;VENTA           ;APARTAMENTO         ;NUEVO     ;SIMON BOLIVAR;5;90;45;350000000;3888889;-75,60491484;6,24453743;2021;11;4
179975;04-11-2021;VENTA           ;APARTAMENTO         ;NUEVO     ;LA MANSION;3;57;260;197000000;3456140;-75,55614841;6,26014472;2021;11;4
180142;11-11-2021;VENTA           ;APARTAMENTO         ;NUEVO     ;FATIMA;4;107;53;390000000;3644860;-75,58582782;6,23803806;2021;11;11
180144;11-11-2021;VENTA           ;APARTAMENTO         ;NUEVO     ;FATIMA;3;85;106;310000000;3647059;-75,58435728;6,23396171;2021;11;11
180194;12-11-2021;VENTA           ;APARTAMENTO         ;NUEVO     ;CAMPO AMOR;4;84;21;220000000;2619048;-75,58790241;6,21078457;2021;11;12
180195;12-11-2021;VENTA           ;APARTAMENTO         ;NUEVO     ;CAMPO AMOR;4;80;57;265000000;3312500;-75,58656597;6,21202982;2021;11;12
180210;12-11-2021;VENTA           ;APARTAMENTO         ;NUEVO     ;SANTA FE;4;44;21;150000000;3409091;-75,58102382;6,2253403;2021;11;12
180211;12-11-2021;VENTA           ;APARTAMENTO         ;NUEVO     ;SANTA FE;4;61;24;160000000;2622951;-75,58102382;6,2253403;2021;11;12
180221;16-11-2021;VENTA           ;APARTAMENTO         ;NUEVO     ;SANTA FE;4;106;67;165000000;1556604;-75,58734188;6,2227726;2021;11;16
180225;16-11-2021;VENTA           ;APARTAMENTO         ;NUEVO     ;BARRIO DE JESUS;3;44;15;125000000;2840909;-75,53509508;6,22865123;2021;11;16
180226;16-11-2021;VENTA           ;APARTAMENTO         ;NUEVO     ;BARRIO DE JESUS;3;42;15;132000000;3142857;-75,53509508;6,22865123;2021;11;16
180232;16-11-2021;VENTA           ;APARTAMENTO         ;NUEVO     ;LA CASTELLANA;5;82;31;495000000;6036585;-75,60571161;6,24138072;2021;11;16
180234;16-11-2021;VENTA           ;APARTAMENTO         ;NUEVO     ;ALEJANDRO ECHAVARRIA;3;80;150;180000000;2250000;-75,54656613;6,23835206;2021;11;16
180237;16-11-2021;VENTA           ;APARTAMENTO         ;NUEVO     ;ALEJANDRO ECHAVARRIA;3;80;150;210000000;2625000;-75,54656613;6,23835206;2021;11;16
180238;16-11-2021;VENTA           ;APARTAMENTO         ;NUEVO     ;ALEJANDRO ECHAVARRIA;3;71;134;170000000;2394366;-75,54656613;6,23835206;2021;11;16
180255;16-11-2021;VENTA           ;APARTAMENTO         ;NUEVO     ;LOS CONQUISTADORES;6;93;19;420000000;4516129;-75,57867841;6,24056273;2021;11;16
180264;16-11-2021;VENTA           ;APARTAMENTO         ;NUEVO     ;MIRAFLORES;4;80;30;235000000;2937500;-75,55045833;6,23851398;2021;11;16
180294;17-11-2021;VENTA           ;APARTAMENTO         ;NUEVO     ;VILLA HERMOSA;3;143;57;350000000;2447552;-75,55362338;6,25832572;2021;11;17
180295;17-11-2021;VENTA           ;APARTAMENTO         ;NUEVO     ;VILLA HERMOSA;3;93;42;230000000;2473118;-75,55362338;6,25832572;2021;11;17
180300;17-11-2021;VENTA           ;APARTAMENTO         ;NUEVO     ;MIRAVALLE;4;124;48;360000000;2903226;-75,60005839;6,23478921;2021;11;17
180308;17-11-2021;VENTA           ;APARTAMENTO         ;NUEVO     ;MIRAVALLE;5;113;265;682000000;6035398;-75,60037544;6,23697964;2021;11;17
180326;17-11-2021;VENTA           ;APARTAMENTO         ;NUEVO     ;EL NOGAL - LOS ALMENDROS;5;128;21;560000000;4375000;-75,59883514;6,23680289;2021;11;17
180327;17-11-2021;VENTA           ;APARTAMENTO         ;NUEVO     ;EL NOGAL - LOS ALMENDROS;5;128;21;650000000;5078125;-75,59883514;6,23680289;2021;11;17
180334;18-11-2021;VENTA           ;APARTAMENTO         ;NUEVO     ;ROSALES;5;86;222;425000000;4941860;-75,59503678;6,236337;2021;11;18
180335;18-11-2021;VENTA           ;APARTAMENTO         ;NUEVO     ;ROSALES;5;110;252;495000000;4500000;-75,59232079;6,23786828;2021;11;18
180336;18-11-2021;VENTA           ;APARTAMENTO         ;NUEVO     ;BELEN;4;75;22;430000000;5733333;-75,5944141;6,2352654;2021;11;18
180350;18-11-2021;VENTA           ;APARTAMENTO         ;NUEVO     ;BELEN;4;92;17;305000000;3315217;-75,59513437;6,23361573;2021;11;18
180352;18-11-2021;VENTA           ;APARTAMENTO         ;NUEVO     ;EL NOGAL - LOS ALMENDROS;5;75;22;430000000;5733333;-75,59710154;6,23853731;2021;11;18
180355;18-11-2021;VENTA           ;APARTAMENTO         ;NUEVO     ;EL NOGAL - LOS ALMENDROS;5;103;27;550000000;5339806;-75,59768458;6,23814834;2021;11;18
180382;19-11-2021;VENTA           ;APARTAMENTO         ;NUEVO     ;EL NOGAL - LOS ALMENDROS;5;93;238;530000000;5698925;-75,59927608;6,23809206;2021;11;19
180386;19-11-2021;VENTA           ;APARTAMENTO         ;NUEVO     ;EL NOGAL - LOS ALMENDROS;6;91;23;560000000;6153846;-75,59720432;6,23796221;2021;11;19
180387;19-11-2021;VENTA           ;APARTAMENTO         ;NUEVO     ;EL NOGAL - LOS ALMENDROS;6;91;24;530000000;5824176;-75,59720432;6,23796221;2021;11;19
180397;19-11-2021;VENTA           ;APARTAMENTO         ;NUEVO     ;LAS ACACIAS;5;100;197;500000000;5000000;-75,59996942;6,2419669;2021;11;19
180398;19-11-2021;VENTA           ;APARTAMENTO         ;NUEVO     ;LAURELES;5;132;26;700000000;5303030;-75,59877279;6,24322497;2021;11;19
180405;19-11-2021;VENTA           ;APARTAMENTO         ;NUEVO     ;BUENOS AIRES;3;55;0;247500000;4500000;-75,55981822;6,24228175;2021;11;19
180406;19-11-2021;VENTA           ;APARTAMENTO         ;NUEVO     ;BUENOS AIRES;3;60;0;270000000;4500000;-75,55981822;6,24228175;2021;11;19
180412;19-11-2021;VENTA           ;APARTAMENTO         ;NUEVO     ;FERRINI;5;100;338;610000000;6100000;-75,59755221;6,2685497;2021;11;19
180427;19-11-2021;VENTA           ;APARTAMENTO         ;NUEVO     ;CALASANZ;6;100;26;500000000;5000000;-75,59958838;6,26076218;2021;11;19
180448;22-11-2021;VENTA           ;APARTAMENTO         ;NUEVO     ;CALASANZ;6;122;38;430000000;3524590;-75,5991763;6,26138193;2021;11;22
180461;22-11-2021;VENTA           ;APARTAMENTO         ;NUEVO     ;FATIMA;4;62;23;250000000;4032258;-75,58465588;6,23494112;2021;11;22
180505;24-11-2021;VENTA           ;APARTAMENTO         ;NUEVO     ;BELEN;5;85;25;329000000;3870588;-75,59387391;6,23324033;2021;11;24
180550;24-11-2021;VENTA           ;APARTAMENTO         ;NUEVO     ;LA MILAGROSA;3;51;682;217000000;4254902;-75,55372832;6,23453424;2021;11;24
180551;24-11-2021;VENTA           ;APARTAMENTO         ;NUEVO     ;LA MILAGROSA;3;51;682;219000000;4294118;-75,55372832;6,23453424;2021;11;24
180830;03-12-2021;VENTA           ;APARTAMENTO         ;NUEVO     ;LA MILAGROSA;3;51;0;217000000;4254902;-75,55385867;6,23469171;2021;12;3
180833;03-12-2021;VENTA           ;APARTAMENTO         ;NUEVO     ;JESUS NAZARENO;3;93;41;210000000;2258065;-75,56879799;6,26029575;2021;12;3
180834;03-12-2021;VENTA           ;APARTAMENTO         ;NUEVO     ;JESUS NAZARENO;3;81;36;180000000;2222222;-75,56879799;6,26029575;2021;12;3
180878;07-12-2021;VENTA           ;APARTAMENTO         ;NUEVO     ;BOMBONA # 1;4;42;0;205432000;4891238;-75,55972604;6,24380445;2021;12;7
180879;07-12-2021;VENTA           ;APARTAMENTO         ;NUEVO     ;BOMBONA # 1;3;34;0;153000000;4500000;-75,55993718;6,24359533;2021;12;7
180880;07-12-2021;VENTA           ;APARTAMENTO         ;NUEVO     ;BOMBONA # 1;3;51;0;195900000;3841176;-75,55993718;6,24359533;2021;12;7
180881;07-12-2021;VENTA           ;APARTAMENTO         ;NUEVO     ;BOSTON;4;64;0;273000000;4265625;-75,55659173;6,24870202;2021;12;7
181018;13-12-2021;VENTA           ;APARTAMENTO         ;NUEVO     ;ROSALES;5;84;226;495000000;5892857;-75,58919137;6,23807049;2021;12;13
181034;14-12-2021;VENTA           ;APARTAMENTO         ;NUEVO     ;VDA LAS PALMAS;3;42;138633;261710000;6231190;-75,55247972;6,22578379;2021;12;14
181046;14-12-2021;VENTA           ;APARTAMENTO         ;NUEVO     ;VDA PIEDRAS BLANCAS;1;92;0;270000000;2934783;-75,5344181;6,26272337;2021;12;14
181049;14-12-2021;VENTA           ;APARTAMENTO         ;NUEVO     ;VDA LAS PALMAS;3;60;138633;345475000;5757917;-75,55247972;6,22578379;2021;12;14
181050;14-12-2021;VENTA           ;APARTAMENTO         ;NUEVO     ;VDA LAS PALMAS;3;66;138633;40625000;615530;-75,55247972;6,22578379;2021;12;14
181060;14-12-2021;VENTA           ;APARTAMENTO         ;NUEVO     ;LAS ACACIAS;5;202;0;950000000;4702970;-75,59917357;6,2422886;2021;12;14
181064;14-12-2021;VENTA           ;APARTAMENTO         ;NUEVO     ;LAS ACACIAS;5;77;0;472000000;6129870;-75,59917357;6,2422886;2021;12;14
181066;14-12-2021;VENTA           ;APARTAMENTO         ;NUEVO     ;ALTOS DEL POBLADO;6;55;654;399700000;7267273;-75,55247765;6,21554745;2021;12;14
181067;14-12-2021;VENTA           ;APARTAMENTO         ;NUEVO     ;ALTOS DEL POBLADO;6;66;654;502000000;7606061;-75,55247765;6,21554745;2021;12;14
181069;14-12-2021;VENTA           ;APARTAMENTO         ;NUEVO     ;ALTOS DEL POBLADO;6;71;654;542000000;7633803;-75,55247765;6,21554745;2021;12;14
181070;14-12-2021;VENTA           ;APARTAMENTO         ;NUEVO     ;ALTOS DEL POBLADO;6;83;654;617000000;7433735;-75,55247765;6,21554745;2021;12;14
181078;14-12-2021;VENTA           ;APARTAMENTO         ;NUEVO     ;LOS CONQUISTADORES;6;85;0;440000000;5176471;-75,58586199;6,24202748;2021;12;14
181091;14-12-2021;VENTA           ;APARTAMENTO         ;NUEVO     ;LAURELES;5;37;288;289800000;7832432;-75,59656045;6,23994247;2021;12;14
181127;15-12-2021;VENTA           ;APARTAMENTO         ;NUEVO     ;SAN LUCAS;6;49;12679;496000000;10122449;-75,56289159;6,18354361;2021;12;15
181246;16-12-2021;VENTA           ;APARTAMENTO         ;NUEVO     ;VILLA CARLOTA;4;85;43513;643117000;7566082;-75,57439019;6,21918294;2021;12;16
181256;16-12-2021;VENTA           ;APARTAMENTO         ;NUEVO     ;VILLA CARLOTA;4;97;43513;707931650;7298264;-75,57439019;6,21918294;2021;12;16
181272;16-12-2021;VENTA           ;APARTAMENTO         ;NUEVO     ;ASOMADERA # 2;6;84;9916;760000000;9047619;-75,55948682;6,21786882;2021;12;16
170972;26-01-2021;VENTA           ;APARTAMENTO         ;USADO     ;BOSTON;4;155;37;400000000;2580645;-75,56199053;6,24787191;2021;1;26
170980;26-01-2021;VENTA           ;APARTAMENTO         ;USADO     ;SANTA LUCIA;3;34;5;160000000;4705882;-75,60311963;6,25948528;2021;1;26
170982;26-01-2021;VENTA           ;APARTAMENTO         ;USADO     ;SANTA LUCIA;3;39;5;165000000;4230769;-75,60311963;6,25948528;2021;1;26
170984;26-01-2021;VENTA           ;APARTAMENTO         ;USADO     ;SANTA LUCIA;3;45;6;180000000;4000000;-75,60311963;6,25948528;2021;1;26
170990;26-01-2021;VENTA           ;APARTAMENTO         ;USADO     ;BOSTON;4;162;17;390000000;2407407;-75,56230039;6,24800214;2021;1;26
170991;26-01-2021;VENTA           ;APARTAMENTO         ;USADO     ;LA CANDELARIA;4;240;36;370000000;1541667;-75,56321037;6,24898271;2021;1;26
171020;28-01-2021;VENTA           ;APARTAMENTO         ;USADO     ;LA CANDELARIA;4;189;18;370000000;1957672;-75,56266391;6,24873259;2021;1;28
171021;28-01-2021;VENTA           ;APARTAMENTO         ;USADO     ;LA CANDELARIA;4;133;24;280000000;2105263;-75,5630552;6,24801723;2021;1;28
171023;28-01-2021;VENTA           ;APARTAMENTO         ;USADO     ;LA CANDELARIA;4;157;28;350000000;2229299;-75,5630552;6,24801723;2021;1;28
171035;02-02-2021;VENTA           ;APARTAMENTO         ;USADO     ;PALENQUE;3;60;36;160000000;2666667;-75,59615496;6,28236162;2021;2;2
171074;03-02-2021;VENTA           ;APARTAMENTO         ;USADO     ;NARANJAL;5;205;81;480000000;2341463;-75,58637104;6,25152725;2021;2;3
171082;04-02-2021;VENTA           ;APARTAMENTO         ;USADO     ;AURES # 2;2;45;128;70000000;1555556;-75,59517997;6,29315336;2021;2;4
171086;04-02-2021;VENTA           ;APARTAMENTO         ;USADO     ;EL DIAMANTE;3;58;7;190000000;3275862;-75,58488996;6,28404621;2021;2;4
171089;04-02-2021;VENTA           ;APARTAMENTO         ;USADO     ;EL DIAMANTE;2;114;49;200000000;1754386;-75,58600923;6,28331602;2021;2;4
171090;04-02-2021;VENTA           ;APARTAMENTO         ;USADO     ;EL DIAMANTE;2;110;33;270000000;2454545;-75,58614938;6,28304956;2021;2;4
171097;04-02-2021;VENTA           ;APARTAMENTO         ;USADO     ;EL DIAMANTE;2;133;63;280000000;2105263;-75,58749714;6,2847504;2021;2;4
171100;04-02-2021;VENTA           ;APARTAMENTO         ;USADO     ;EL DIAMANTE;2;112;46;170000000;1517857;-75,58808486;6,28529621;2021;2;4
171121;05-02-2021;VENTA           ;APARTAMENTO         ;USADO     ;LA COLINA;3;90;33;230000000;2555556;-75,59559727;6,1985742;2021;2;5
171130;05-02-2021;VENTA           ;APARTAMENTO         ;USADO     ;ROBLEDO;3;54;24;210000000;3888889;-75,5946609;6,27376897;2021;2;5
171135;08-02-2021;VENTA           ;APARTAMENTO         ;USADO     ;PALENQUE;3;78;91;195000000;2500000;-75,59670286;6,2817708;2021;2;8
171136;08-02-2021;VENTA           ;APARTAMENTO         ;USADO     ;PALENQUE;3;63;91;160000000;2539683;-75,59670286;6,2817708;2021;2;8
171137;08-02-2021;VENTA           ;APARTAMENTO         ;USADO     ;PALENQUE;3;69;91;172000000;2492754;-75,59670286;6,2817708;2021;2;8
171155;08-02-2021;VENTA           ;APARTAMENTO         ;USADO     ;POPULAR;2;46;32;43784692;951841;-75,54840256;6,30248091;2021;2;8
171163;08-02-2021;VENTA           ;APARTAMENTO         ;USADO     ;POPULAR;1;111;114;111539381;1004859;-75,5425815;6,30232875;2021;2;8
171165;08-02-2021;VENTA           ;APARTAMENTO         ;USADO     ;SAN PABLO;2;52;59;60382849;1161209;-75,54604489;6,28554675;2021;2;8
171169;09-02-2021;VENTA           ;APARTAMENTO         ;USADO     ;PALENQUE;3;78;91;197000000;2525641;-75,59670286;6,2817708;2021;2;9
171170;09-02-2021;VENTA           ;APARTAMENTO         ;USADO     ;PALENQUE;3;84;91;205000000;2440476;-75,59670286;6,2817708;2021;2;9
171171;09-02-2021;VENTA           ;APARTAMENTO         ;USADO     ;EL DIAMANTE;2;62;38;126000000;2032258;-75,58820745;6,28566728;2021;2;9
171173;09-02-2021;VENTA           ;APARTAMENTO         ;USADO     ;EL DIAMANTE;2;103;63;220000000;2135922;-75,58770966;6,28518359;2021;2;9
171175;09-02-2021;VENTA           ;APARTAMENTO         ;USADO     ;AURES # 1;2;212;57;360000000;1698113;-75,59321806;6,28614882;2021;2;9
171176;09-02-2021;VENTA           ;APARTAMENTO         ;USADO     ;BELLO HORIZONTE;2;121;47;230000000;1900826;-75,58953611;6,28174589;2021;2;9
171177;09-02-2021;VENTA           ;APARTAMENTO         ;USADO     ;BELLO HORIZONTE;2;124;47;220000000;1774194;-75,58953611;6,28174589;2021;2;9
171180;09-02-2021;VENTA           ;APARTAMENTO         ;USADO     ;MONTECLARO;3;41;5;110000000;2682927;-75,59887784;6,28740189;2021;2;9
171181;09-02-2021;VENTA           ;APARTAMENTO         ;USADO     ;AURES # 1;3;58;34;180000000;3103448;-75,59461056;6,28237356;2021;2;9
171195;09-02-2021;VENTA           ;APARTAMENTO         ;USADO     ;SAN PABLO;1;53;134;56874185;1073098;-75,54454197;6,28910318;2021;2;9
171221;10-02-2021;VENTA           ;APARTAMENTO         ;USADO     ;LOS PINOS;4;85;27;225000000;2647059;-75,59895594;6,25032037;2021;2;10
171237;10-02-2021;VENTA           ;APARTAMENTO         ;USADO     ;ZONA EXPANSION PAJARITO;2;57;30;115000000;2017544;-75,60867058;6,28713299;2021;2;10
171266;11-02-2021;VENTA           ;APARTAMENTO         ;USADO     ;ZONA EXPANSION PAJARITO;3;45;11;130000000;2888889;-75,606626;6,28357226;2021;2;11
171273;12-02-2021;VENTA           ;APARTAMENTO         ;USADO     ;ZONA EXPANSION PAJARITO;3;60;5;120000000;2000000;-75,61368129;6,28194264;2021;2;12
171274;12-02-2021;VENTA           ;APARTAMENTO         ;USADO     ;ZONA EXPANSION PAJARITO;3;54;5;115000000;2129630;-75,61391918;6,28213563;2021;2;12
171275;12-02-2021;VENTA           ;APARTAMENTO         ;USADO     ;ZONA EXPANSION PAJARITO;3;54;5;72000000;1333333;-75,61474576;6,28194255;2021;2;12
171276;12-02-2021;VENTA           ;APARTAMENTO         ;USADO     ;ZONA EXPANSION PAJARITO;3;47;10;70000000;1489362;-75,62125808;6,28288504;2021;2;12
171279;12-02-2021;VENTA           ;APARTAMENTO         ;USADO     ;ZONA EXPANSION PAJARITO;3;43;7;106000000;2465116;-75,6127691;6,27961842;2021;2;12
171283;12-02-2021;VENTA           ;APARTAMENTO         ;USADO     ;ZONA EXPANSION PAJARITO;1;49;8;90000000;1836735;-75,61668745;6,28009627;2021;2;12
171284;12-02-2021;VENTA           ;APARTAMENTO         ;USADO     ;ZONA EXPANSION PAJARITO;3;48;28;110000000;2291667;-75,62212465;6,27804177;2021;2;12
171296;12-02-2021;VENTA           ;APARTAMENTO         ;USADO     ;ZONA EXPANSION PAJARITO;2;47;6;80000000;1702128;-75,62169495;6,28002805;2021;2;12
171297;12-02-2021;VENTA           ;APARTAMENTO         ;USADO     ;ZONA EXPANSION PAJARITO;2;47;6;90000000;1914894;-75,62169495;6,28002805;2021;2;12
171348;15-02-2021;VENTA           ;APARTAMENTO         ;USADO     ;SURAMERICANA;4;128;46;270000000;2109375;-75,58229495;6,25560527;2021;2;15
171353;15-02-2021;VENTA           ;APARTAMENTO         ;USADO     ;ZONA EXPANSION PAJARITO;2;47;6;115000000;2446809;-75,62169495;6,28002805;2021;2;15
171367;17-02-2021;VENTA           ;APARTAMENTO         ;USADO     ;ANDALUCIA;2;80;61;103328732;1291609;-75,55221759;6,29670239;2021;2;17
171369;17-02-2021;VENTA           ;APARTAMENTO         ;USADO     ;ANDALUCIA;2;35;41;43442716;1241220;-75,55186095;6,29716572;2021;2;17
171381;17-02-2021;VENTA           ;APARTAMENTO         ;USADO     ;SAN GERMAN;4;65;86;240000000;3692308;-75,5881283;6,27023053;2021;2;17
171387;17-02-2021;VENTA           ;APARTAMENTO         ;USADO     ;ANDALUCIA;2;64;61;81904538;1279758;-75,55304928;6,30019713;2021;2;17
171392;17-02-2021;VENTA           ;APARTAMENTO         ;USADO     ;ANDALUCIA;2;31;16;35185488;1135016;-75,55496033;6,29924357;2021;2;17
171400;17-02-2021;VENTA           ;APARTAMENTO         ;USADO     ;ANDALUCIA;2;88;65;99607062;1131898;-75,55484047;6,2973831;2021;2;17
